playlist_id,video_id,title,published,view_count,like_count,comment_count,duration,definition,tags,default_audio_language,madeforkid,playlist_title,channel_id,channelTitle,playlist_published,playlist_numvideo
PLeo1K3hjS3utOmKEwVWC1paw1hP0oMAEP,buQSI8NLOMw,Data Analyst & Software Engineer Resume Tips and Templates,2022-06-11T15:00:10Z,52655,1468,56,PT24M2S,hd,"['yt:cc=on', 'data analyst resume', 'data analyst resume with no experience', 'data analyst resume for freshers', 'resume templates', 'resume tips', 'resume format for freshers', 'data analyst resume tips and templates', 'data analyst resume tips', 'how to write a data analyst resume', 'data analyst resume guide', 'data analyst resume format', 'data analyst resume sample', 'data analyst skills resume', 'data analyst resume entry level', 'data analyst fresher resume', 'resume template for data analyst']",en,False,Interview & Resume Guidance,UCh9nVJoWXmFb7sLApWGcLPQ,codebasics,2020-08-25T16:36:42Z,11.0
PLeo1K3hjS3utOmKEwVWC1paw1hP0oMAEP,-doYCOojY4w,These folks were HIRED as Data Analysts without an interview!,2023-01-28T13:30:08Z,31111,889,36,PT16M3S,hd,"['yt:cc=on', 'job without interview', 'private job without interview', 'job without exam', 'job without', 'job without experience', 'job without interview 2022', 'how to get a job with no experience', 'how to get a job', 'how to get a job fast', 'how to find a job', 'job search tips', 'job search strategies', 'best job without interview', 'job interview', 'interview tips']",en,False,Interview & Resume Guidance,UCh9nVJoWXmFb7sLApWGcLPQ,codebasics,2020-08-25T16:36:42Z,11.0
PLeo1K3hjS3utOmKEwVWC1paw1hP0oMAEP,34-RThWWRHM,Data Analyst Interview & Job Tips With A Data Analyst | Mechanical Engineer to Data Analyst,2020-06-09T11:30:13Z,63543,1515,117,PT1H29M22S,hd,"['data analyst interview tips', 'data analyst interview', 'data analyst interview skills', 'data analyst interview questions and answers', 'data analytics interview', 'data analyst career guidance', 'data analyst career transition', 'mechanical engineer to data analyst', 'mechanical engineer to data analyst transition', 'mechanical engineering to data analyst', 'michanical engineer to data analyst', 'mechanical engineer turned into a data analyst', 'switch career to data analyst']",en,False,Interview & Resume Guidance,UCh9nVJoWXmFb7sLApWGcLPQ,codebasics,2020-08-25T16:36:42Z,11.0
PLeo1K3hjS3utOmKEwVWC1paw1hP0oMAEP,T-rAYiNjvbk,SQL Interview Questions and Answers Practice | 3 Best Websites,2022-09-01T14:00:20Z,34357,1486,36,PT2M42S,hd,"['yt:cc=on', 'sql interview questions', 'sql interview questions and answers', 'sql interview questions for beginners', 'sql interview questions for freshers', 'sql interview preperation', 'sql interview', 'sql interview preparation', 'interview questions sql', 'interview questions sql basic', 'top sql questions', 'sql interview questions for experienced', 'sql basic questions', 'sql', 'technical interview questions and answers', 'sql practice', 'sql questions and answers practice', 'sql interview questions practice']",en,False,Interview & Resume Guidance,UCh9nVJoWXmFb7sLApWGcLPQ,codebasics,2020-08-25T16:36:42Z,11.0
PLeo1K3hjS3utOmKEwVWC1paw1hP0oMAEP,K_oJLQx2ySY,How to pass a coding interview |Interview tips for software developer |Cracking the coding interview,2020-08-26T12:30:10Z,101214,3080,121,PT20M34S,hd,"['coding interview tips', 'programming interview prep', 'programming interview tips', 'programming interview preparation', 'software engineer interview preparation', 'software engineer interview tips', 'interview tips for software developer', 'Tips to crack a coding interview', 'how to crack coding interview', 'coding interview', 'coding interview preparation', 'how to pass coding interview', 'coding interview tips and tricks', 'prepare for coding interview', 'tips for coding interviews']",en,False,Interview & Resume Guidance,UCh9nVJoWXmFb7sLApWGcLPQ,codebasics,2020-08-25T16:36:42Z,11.0
PLeo1K3hjS3utOmKEwVWC1paw1hP0oMAEP,dLExQ6yc7e4,Not getting interview calls? Try these 3 effective tips,2021-07-12T13:30:10Z,33559,1448,152,PT13M29S,hd,"['yt:cc=on', 'interview calls', 'how to get interview call', 'how to get interview calls', 'get in interview', 'not getting interview calls', 'job interview tips', 'how to get interview calls from big companies', 'not getting interview calls from linkedin', 'not getting calls for job interview', 'not getting called for interviews', 'how to get an interview', ""why you're not getting called for interviews"", 'reason of not getting interview calls', 'tips to get more interview calls', ""why i don't get interview""]",en,False,Interview & Resume Guidance,UCh9nVJoWXmFb7sLApWGcLPQ,codebasics,2020-08-25T16:36:42Z,11.0
PLeo1K3hjS3utOmKEwVWC1paw1hP0oMAEP,9VQAwhp27eU,Data analyst interview tips | How to prepare for data analyst interview,2020-03-28T19:48:59Z,185300,5769,145,PT21M42S,hd,"['data analyst interview tips', 'data analyst interview questions and answers', 'data analyst interview preparation', 'data analyst interview introduction', 'data analyst interview presentation', 'interview data analyst', 'interview tips for data analyst', 'how to crack data analyst interview', 'data analyst interview', 'data analyst', 'data analytics interview questions', 'data analyst interview questions', 'analyst interview questions', 'interview questions for data analyst']",en,False,Interview & Resume Guidance,UCh9nVJoWXmFb7sLApWGcLPQ,codebasics,2020-08-25T16:36:42Z,11.0
PLeo1K3hjS3utOmKEwVWC1paw1hP0oMAEP,8Ert2Soaj9U,Not getting any interview calls? Do this. |  How to get interview calls?,2021-01-16T15:00:09Z,46123,1428,129,PT16M19S,hd,"['how to get interview calls', 'how to get interview calls from naukri', 'how to get interview calls from big companies', 'get interview calls', 'not gettting interview calls', 'how to get interview call', 'how to get interview call from company', 'not getting job what to do', 'how to get more calls from naukri', 'how to get calls from recruiters in naukri', 'how to get calls from naukri', 'tips to get more interview calls', 'reason of not getting interview calls', 'why you are not getting called for job']",en,False,Interview & Resume Guidance,UCh9nVJoWXmFb7sLApWGcLPQ,codebasics,2020-08-25T16:36:42Z,11.0
PLeo1K3hjS3utOmKEwVWC1paw1hP0oMAEP,6ZXHNuwAnPw,Never ask this question to anyone! ðŸ¤«âŒ#codebasics #shorts #dataanalysis #data,2023-09-30T12:30:04Z,16565,851,8,PT16S,hd,"['interview tip', 'not to do in interview', 'do not ask this question']",en,False,Interview & Resume Guidance,UCh9nVJoWXmFb7sLApWGcLPQ,codebasics,2020-08-25T16:36:42Z,11.0
PLeo1K3hjS3uu7CxAacxVndI4bE_o3BDtO,Mubj_fqiAv8,"Introduction | Deep Learning Tutorial 1 (Tensorflow Tutorial, Keras & Python)",2020-07-11T13:00:10Z,550953,7182,199,PT3M39S,hd,"['deep learning tutorial', 'tensorflow tutorial', 'tensorflow 2.0 tutorial python', 'python deep learning tutorial', 'deep learning tutorial for begininer', 'python deep learning example', 'deep learning tutorial for beginners', 'deep learning tutorial python', 'deep learning', 'tensorflow tutorial for beginners', 'tensorflow2.0 tutorial', 'tensorflow\xa02.0\xa0tutorial\xa0python', 'tensorflow with python', 'deep learning complete tutorial', 'deep learning with tensorflow', 'tensorflow tutorial python', 'tensorflow']",en,False,"Deep Learning With Tensorflow 2.0, Keras and Python",UCh9nVJoWXmFb7sLApWGcLPQ,codebasics,2020-07-10T22:15:04Z,57.0
PLeo1K3hjS3uu7CxAacxVndI4bE_o3BDtO,yfsTZbwgMSE,"Why deep learning is becoming so popular? | Deep Learning Tutorial 2 (Tensorflow2.0, Keras & Python)",2020-07-12T13:00:10Z,179634,2641,58,PT5M25S,hd,"['deep learning tutorial', 'tensorflow tutorial', 'tensorflow 2.0 tutorial python', 'kera tutorial', 'python deep learning tutorial', 'python deep learning example', 'tensorflow tutorial for beginners', 'tensorflow', 'deep learning tutorial for beginner', 'tensorflow2.0 tutorial', 'deep learning tutorial for beginners', 'deep learning tutorial python', 'deep learning python', 'what is deep learning and how it works', 'deep learning explained', 'deep learning in simple explanation', 'tensorflow tutorial python']",en,False,"Deep Learning With Tensorflow 2.0, Keras and Python",UCh9nVJoWXmFb7sLApWGcLPQ,codebasics,2020-07-10T22:15:04Z,57.0
PLeo1K3hjS3uu7CxAacxVndI4bE_o3BDtO,VhRtaziEWd4,"What is a neuron? | Deep Learning Tutorial 3 (Tensorflow Tutorial, Keras & Python)",2020-07-13T13:00:10Z,228394,9652,412,PT16M49S,hd,"['tensorflow neuron', 'kera neuron tutorial', 'tensorflow neuron tutorial for begininers', 'what is a neuron', 'simple explanation of neuron', 'tensorflow neuron tutorial python', 'tensorflow neuron tutorial for beginners', 'deep learning neuron', 'deep learning neuron tutorial', 'python deep learning neuron tutorial', 'neural in ai', 'neural in artificial intelligence', 'introduction neuron in deep learning', 'introduction neuron', 'tensorflow neuron tutorial', 'python neuron', 'python neuron tutorial']",en,False,"Deep Learning With Tensorflow 2.0, Keras and Python",UCh9nVJoWXmFb7sLApWGcLPQ,codebasics,2020-07-10T22:15:04Z,57.0
PLeo1K3hjS3uu7CxAacxVndI4bE_o3BDtO,ER2It2mIagI,"Neural Network Simply Explained | Deep Learning Tutorial 4 (Tensorflow2.0, Keras & Python)",2020-07-14T12:30:09Z,305809,11543,983,PT11M1S,hd,"['how neural network works', 'neural network tutorial', 'neural network', 'neural network tutorial for beginners', 'what are neural networks', 'neural network explained', 'what is a neural network', 'deep learning neueal network', 'simple explanation of neural network', 'artificial neural network', 'what is neural network', 'introduction to neural networks', 'neural network simply explained', 'neural network simple example', 'neural network simplified']",en,False,"Deep Learning With Tensorflow 2.0, Keras and Python",UCh9nVJoWXmFb7sLApWGcLPQ,codebasics,2020-07-10T22:15:04Z,57.0
PLeo1K3hjS3uu7CxAacxVndI4bE_o3BDtO,VC-EliTgMEM,"Install tensorflow 2.0 | Deep Learning Tutorial 5 (Tensorflow Tutorial, Keras & Python)",2020-07-16T12:30:03Z,210364,1829,159,PT2M37S,hd,"['install tensorflow windows', 'install tensorflow', 'install tensorflow windows 10', 'how to install tensorflow', 'how to install tensorflow in jupyter notebook', 'how to install tensorflow on windows 10', 'how to install tensorflow in anaconda', 'install tensorflow in jupyter notebook', 'install tensorflow in anaconda', 'tensorflow installation windows 10', 'tensorflow install', 'how to install tensorflow in python 3.10', 'install tensorflow in python 3.10', 'install tensorflow in pycharm']",en,False,"Deep Learning With Tensorflow 2.0, Keras and Python",UCh9nVJoWXmFb7sLApWGcLPQ,codebasics,2020-07-10T22:15:04Z,57.0
PLeo1K3hjS3uu7CxAacxVndI4bE_o3BDtO,z-ZR_8BZ1wQ,"Pytorch vs Tensorflow vs Keras | Deep Learning Tutorial 6 (Tensorflow Tutorial, Keras & Python)",2020-07-17T12:30:57Z,177087,2671,49,PT2M17S,hd,"['kera tutorial', 'pytorch vs tensorflow', 'pytorch vs tensorflow vs keras', 'tensorflow vs keras', 'keras', 'tensorflow vs pytorch', 'keras vs tensorflow', 'pytorch', 'keras tutorial', 'keras vs tensorflow vs pytorch', 'keras vs pytorch', 'tensorflow', 'deep learnign with keras tensorflow and pytorch', 'deep learning keras', 'pytorch vs tensorflow for beginners', 'pytorch vs tensorflow performance', 'pytorch and tensorflow difference', 'tensorflow vs Keras difference', 'difference between pytorch keras tensorflow']",en,False,"Deep Learning With Tensorflow 2.0, Keras and Python",UCh9nVJoWXmFb7sLApWGcLPQ,codebasics,2020-07-10T22:15:04Z,57.0
PLeo1K3hjS3uu7CxAacxVndI4bE_o3BDtO,iqQgED9vV7k,Neural Network For Handwritten Digits Classification | Deep Learning Tutorial 7 (Tensorflow2.0),2020-07-18T13:30:09Z,330352,5753,452,PT36M39S,hd,"['digit recognition neural network', 'handwritten digit recognition using tensorflow', 'handwritten digit recognition', 'handwritten digit recognition using cnn', 'handwritten digits classification', 'handwritten digit recognition with tensorflow', 'mnist neural network', 'mnist digit recognition', 'handwritten recognition using neural network', 'mnist digit recognition python', 'digit recognition using machine learning', 'convolutional neural network mnist', 'handwritten digits classification using cnn']",en,False,"Deep Learning With Tensorflow 2.0, Keras and Python",UCh9nVJoWXmFb7sLApWGcLPQ,codebasics,2020-07-10T22:15:04Z,57.0
PLeo1K3hjS3uu7CxAacxVndI4bE_o3BDtO,icZItWxw7AI,"Activation Functions | Deep Learning Tutorial 8 (Tensorflow Tutorial, Keras & Python)",2020-07-20T12:30:08Z,185832,6340,158,PT16M29S,hd,"['activation functions neural networks', 'activation function explained', 'activation functions in deep learning', 'activation functions in machine learning', 'activation function example', 'activation function relu', 'activation function tanh', 'activation function in neural network', 'activation functions', 'relu activation function', 'relu activation function tensorflow', 'relu activation function keras', 'activation function keras', 'relu activation function python', 'activation function deep learning']",en,False,"Deep Learning With Tensorflow 2.0, Keras and Python",UCh9nVJoWXmFb7sLApWGcLPQ,codebasics,2020-07-10T22:15:04Z,57.0
PLeo1K3hjS3uu7CxAacxVndI4bE_o3BDtO,cT4pQT5Da0Q,"Derivatives | Deep Learning Tutorial 9 (Tensorflow Tutorial, Keras & Python)",2020-08-01T13:30:10Z,87174,2565,168,PT12M35S,hd,"['derivative neural network', 'partial derivative explained', 'derivatives deep learning', 'derivatives tensorflow', 'derivatives neural network', 'derivatives training in deep learning', 'derivative deep learning', 'derivative in tensorflow', 'deep learning derivative tutorial', 'derivative keras', 'derivative deep learning in neural network', 'derivative in deep learning', 'how to use derivative in deep learning', 'deep learning and derivative', 'the derivative deep learning', 'derivative for deep learning']",en,False,"Deep Learning With Tensorflow 2.0, Keras and Python",UCh9nVJoWXmFb7sLApWGcLPQ,codebasics,2020-07-10T22:15:04Z,57.0
PLeo1K3hjS3uu7CxAacxVndI4bE_o3BDtO,Wibxjrxf5ko,"Matrix Basics | Deep Learning Tutorial 10 (Tensorflow Tutorial, Keras & Python)",2020-08-04T14:00:10Z,88922,2243,62,PT11M42S,hd,"['matrix explained', 'matrix deep learning', 'matrix in neural network training', 'neural network training matrix', 'deep learning training matrix', 'matrix in python', 'python matrix', 'matrix python', 'deep learning matrix', 'matrices in python', 'matrices python', 'matrices for deep learning', 'deep learning matrices', 'matrices in deep learning', 'matrix input neural network', 'matrix tensorflow', 'matrix keras', 'matrix keras tutorial', 'matrix tensorflow tutorial', 'matrix in deep learning']",en,False,"Deep Learning With Tensorflow 2.0, Keras and Python",UCh9nVJoWXmFb7sLApWGcLPQ,codebasics,2020-07-10T22:15:04Z,57.0
PLeo1K3hjS3uu7CxAacxVndI4bE_o3BDtO,E1yyaLRUnLo,"Loss or Cost Function | Deep Learning Tutorial 11 (Tensorflow Tutorial, Keras & Python)",2020-08-14T18:10:33Z,116331,2731,95,PT24M37S,hd,"['neural network cost function', 'neural network cost function python code', 'cost function tensorflow', 'deep learning cost function', 'loss function', 'loss function neural network', 'loss function in deep learning', 'cost function deep learning', 'loss function deep learning', 'loss function explained', 'cost function', 'cost function keras', 'loss function keras', 'deep learning cost', 'Cost function deep learning', 'what is loss function in deep learning', 'loss function in neural network']",en,False,"Deep Learning With Tensorflow 2.0, Keras and Python",UCh9nVJoWXmFb7sLApWGcLPQ,codebasics,2020-07-10T22:15:04Z,57.0
PLeo1K3hjS3uu7CxAacxVndI4bE_o3BDtO,pXGBHV3y8rs,"Gradient Descent For Neural Network | Deep Learning Tutorial 12 (Tensorflow2.0, Keras & Python)",2020-08-14T17:35:49Z,140016,3539,307,PT41M34S,hd,"['gradient descent neural network', 'gradient descent neural network example', 'gradient descent neural network explained', 'gradient descent how neural networks learn', 'gradient descent', 'gradient descent deep learning', 'what is gradient descent in deep learning', 'deep learning gradient descent', 'what is gradient descent in neural network', 'gradient descent in tensorflow', 'gradient descent in keras', 'deep learning gradient descent tutorial', 'gradient descent in deep learning']",en,False,"Deep Learning With Tensorflow 2.0, Keras and Python",UCh9nVJoWXmFb7sLApWGcLPQ,codebasics,2020-07-10T22:15:04Z,57.0
PLeo1K3hjS3uu7CxAacxVndI4bE_o3BDtO,PQCE9ChuIDY,"Implement Neural Network In Python | Deep Learning Tutorial 13 (Tensorflow2.0, Keras & Python)",2020-08-15T14:00:10Z,82516,1499,74,PT13M23S,hd,"['implement neural network from scratch python', 'Implement Neural Network In Python', 'implement neural network', 'neural network python', 'implement neural network in python', 'neural network in python', 'neural network implementation', 'neural networks', 'deep learning', 'implement neural network in keras', 'implement neural network in tensorflow', 'deep learning neural network implementation', 'keras neural network implementation', 'tensorflow neural network implementation']",en,False,"Deep Learning With Tensorflow 2.0, Keras and Python",UCh9nVJoWXmFb7sLApWGcLPQ,codebasics,2020-07-10T22:15:04Z,57.0
PLeo1K3hjS3uu7CxAacxVndI4bE_o3BDtO,IU5fuoYBTAM,Stochastic Gradient Descent vs Batch Gradient Descent vs Mini Batch Gradient Descent |DL Tutorial 14,2020-08-18T16:00:12Z,129240,3368,223,PT36M47S,hd,"['stochastic gradient descent python', 'stochastic gradient descent vs gradient descent', 'mini batch gradient descent python code', 'mini batch gradient descent vs batch gradient descent', 'mini batch gradient descent', 'stochastic gradient descent', 'batch gradient descent', 'gradient descent vs stochastic gradient descent', 'batch gradient descent vs stochastic gradient descent', 'stochastic gradient descent explained', 'stochastic gradient descent medium', 'stochastic gradient descent convergence']",en,False,"Deep Learning With Tensorflow 2.0, Keras and Python",UCh9nVJoWXmFb7sLApWGcLPQ,codebasics,2020-07-10T22:15:04Z,57.0
PLeo1K3hjS3uu7CxAacxVndI4bE_o3BDtO,5ogmEkujoqE,"Chain Rule | Deep Learning Tutorial 15 (Tensorflow2.0, Keras & Python)",2020-08-24T12:30:09Z,61382,2251,96,PT14M6S,hd,"['chain rule derivatives', 'backpropagation chain rule example', 'chain rule of differentiation with backpropagation', 'keras backpropagation', 'chain rule deep learning', 'backpropagation chain rule keras', 'backpropagation chain rule tensorflow', 'tensorflow chain rule tutorial', 'deep learning chain rule tutorial', 'keras chain rule tutorial', 'chain rule keras', 'chain rule tensorflow', 'simple explanation of a chain rule', 'chain rule implementation']",en,False,"Deep Learning With Tensorflow 2.0, Keras and Python",UCh9nVJoWXmFb7sLApWGcLPQ,codebasics,2020-07-10T22:15:04Z,57.0
PLeo1K3hjS3uu7CxAacxVndI4bE_o3BDtO,9SdLOcGnebU,"Tensorboard Introduction | Deep Learning Tutorial 16 (Tensorflow2.0, Keras & Python)",2020-08-29T14:00:11Z,71175,1579,63,PT14M56S,hd,"['tensorboard tutorial', 'tensorboard', 'tensorboard graph deep learning tutorial', 'kera tutorial', 'tensorboard jupyter notebook', 'pytorch tensorboard', 'tensorboard tutorial pytorch', 'tensorboard tutorial tensorflow', 'tensorboard tutorial keras', 'tensorboard tutorial for beginners', 'tensorboard keras', 'tensorboard deep learning', 'tensorflow tensorboard tutorial', 'tensorboard python tutorial', 'tensorflow tensorboard example', 'tensorboard tensorflow tutorial', 'using tensorboard with keras']",en,False,"Deep Learning With Tensorflow 2.0, Keras and Python",UCh9nVJoWXmFb7sLApWGcLPQ,codebasics,2020-07-10T22:15:04Z,57.0
PLeo1K3hjS3uu7CxAacxVndI4bE_o3BDtO,YmDaqXMIoeY,"GPU bench-marking with image classification | Deep Learning Tutorial 17 (Tensorflow2.0, Python)",2020-08-31T12:30:25Z,58611,1385,87,PT23M58S,hd,"['deep learning gpu benchmarks', 'deep learning gpu vs cpu', 'deep learning gpu training system', 'cpu vs gpu deep learning', 'deep learning gpu', 'deep learning gpu performance test', 'gpu performance test', 'gpu performance deep learning', 'nvidia gpu for deep learning', 'deep learning gpu requirements', 'deep learning gpu benchmarks 2022', 'gpu benchmarks for deep learning', 'gpu', 'nvidia', 'deep learning', 'deep learning uses gpus', 'tensorflow benchmark', 'rtx cards for deep learning', 'pytorch benchmark']",en,False,"Deep Learning With Tensorflow 2.0, Keras and Python",UCh9nVJoWXmFb7sLApWGcLPQ,codebasics,2020-07-10T22:15:04Z,57.0
PLeo1K3hjS3uu7CxAacxVndI4bE_o3BDtO,MSBY28IJ47U,"Customer churn prediction using ANN | Deep Learning Tutorial 18 (Tensorflow2.0, Keras & Python)",2020-09-07T15:30:10Z,146739,2870,187,PT40M41S,hd,"['customer churn prediction', 'customer churn prediction python', 'churn prediction ann', 'churn prediction', 'customer churn prediction analysis', 'customer churn prediction in python', 'churn prediction python', 'customer churn deep learning', 'customer churn machine learning', 'customer churn prediction using machine learning', 'churn prediction machine learning', 'customer churn prediction ann', 'churn prediction model', 'churn prediction project', 'develop churn prediction model using python']",en,False,"Deep Learning With Tensorflow 2.0, Keras and Python",UCh9nVJoWXmFb7sLApWGcLPQ,codebasics,2020-07-10T22:15:04Z,57.0
PLeo1K3hjS3uu7CxAacxVndI4bE_o3BDtO,2osIZ-dSPGE,"Precision, Recall, F1 score, True Positive|Deep Learning Tutorial 19 (Tensorflow2.0, Keras & Python)",2020-09-08T16:00:09Z,201111,4836,226,PT11M46S,hd,"['precision vs recall', 'precision vs recall vs f1', 'precision vs recall vs accuracy', 'precision vs recall machine learning', 'precision vs recall example', 'true positive false positive', 'true positive metrics', 'true positive rate confusion matrix', 'what is f1 score', 'precision and recall', 'precision recall', 'f1 score', 'f1 score deep learning', 'precision and recall formula', 'f1 score formula', 'true positive', 'precision deep learning', 'recall deep learning', 'true positive deep learning']",en,False,"Deep Learning With Tensorflow 2.0, Keras and Python",UCh9nVJoWXmFb7sLApWGcLPQ,codebasics,2020-07-10T22:15:04Z,57.0
PLeo1K3hjS3uu7CxAacxVndI4bE_o3BDtO,lcI8ukTUEbo,"Dropout Regularization | Deep Learning Tutorial 20 (Tensorflow2.0, Keras & Python)",2020-09-23T13:00:13Z,69771,2210,71,PT19M2S,hd,"['dropout regularization in deep learning', 'dropout regularization technique', 'dropout regularisation', 'dropout layer deep learning', 'dropout layer explained', 'dropout layer definition deep learning tutorial', 'regularization technique', 'regularization deep learning', 'dropout in neural network', 'dropout regularization', 'regularization machine learning', 'dropout deep learning', 'dropout neural network', 'dropout neural networks', 'dropout in convolutional layers', 'lstm dropout keras']",en,False,"Deep Learning With Tensorflow 2.0, Keras and Python",UCh9nVJoWXmFb7sLApWGcLPQ,codebasics,2020-07-10T22:15:04Z,57.0
PLeo1K3hjS3uu7CxAacxVndI4bE_o3BDtO,JnlM4yLFNuo,Handling imbalanced dataset in machine learning | Deep Learning Tutorial 21 (Tensorflow2.0 & Python),2020-09-24T13:00:04Z,150313,3314,204,PT38M26S,hd,"['imbalanced dataset machine learning', 'handling imbalanced datasets in deep learning', 'handling imbalanced datasets in machine learning', 'smote technique in machine learning', 'imblearn smote example', 'imblearn oversampling', 'imblearn python example deep learning tutorial', 'imbalanced dataset', 'imbalanced data machine learning', 'how to handle imbalanced dataset', 'class imbalance machine learning', 'smote', 'extremely imbalanced dataset', 'binary classification imbalanced dataset']",en,False,"Deep Learning With Tensorflow 2.0, Keras and Python",UCh9nVJoWXmFb7sLApWGcLPQ,codebasics,2020-07-10T22:15:04Z,57.0
PLeo1K3hjS3uu7CxAacxVndI4bE_o3BDtO,aDpnaxPAmtU,"Applications of computer vision | Deep Learning Tutorial 22 (Tensorflow2.0, Keras & Python)",2020-10-08T12:30:10Z,74996,2394,62,PT9M44S,hd,"['computer vision applications', 'computer vision algorithms and applications', 'deep learning and computer vision', 'deep learning computer vision tutorial', 'computer vision', 'computer vision tutorial', 'computer vision deep learning', 'computer vision projects', 'what is computer vision', 'computer vision python', 'computer vision in artificial intelligence', 'how computer vision works', 'computer vision keras', 'computer vision tensorflow', 'deep learning computer vision applications']",en,False,"Deep Learning With Tensorflow 2.0, Keras and Python",UCh9nVJoWXmFb7sLApWGcLPQ,codebasics,2020-07-10T22:15:04Z,57.0
PLeo1K3hjS3uu7CxAacxVndI4bE_o3BDtO,zfiSAzpy9NM,Simple explanation of convolutional neural network | Deep Learning Tutorial 23 (Tensorflow & Python),2020-10-14T12:30:09Z,769580,17258,666,PT23M54S,hd,"['what is cnn in deep learning', 'what is cnn in machine learning', 'convolutional neural network', 'convolutional neural network explained', 'what is convolutional neural network', 'cnn deep learning', 'convolution neural network', 'cnn tutorial', 'cnn machine learning', 'cnn neural network', 'cnn explained', 'cnn algorithm', 'cnn python', 'what is cnn', 'cnn in deep learning', 'tensorflow cnn', 'deep learning cnn', 'cnn model', 'convolution neural network in deep learning', 'cnn ml', 'cnn image classification']",en,False,"Deep Learning With Tensorflow 2.0, Keras and Python",UCh9nVJoWXmFb7sLApWGcLPQ,codebasics,2020-07-10T22:15:04Z,57.0
