playlist_id,video_id,title,published,view_count,like_count,comment_count,duration,definition,tags,default_audio_language,madeforkid,playlist_title,channel_id,channelTitle,playlist_published,playlist_numvideo
PLeo1K3hjS3ut55QHPU-0Tj-fNRDYdTHhp,oF_2uDb7DvQ,What is ETL | What is Data Warehouse | OLTP vs OLAP,2020-02-15T03:01:38Z,369769,9888,382,PT8M7S,hd,"['OLAP', 'ETL', 'Data Warehouse', 'What is Data Warehouse', 'OLTP', 'etl', 'what is etl', 'etl process', 'etl process in data warehouse', 'data warehouse', 'olap', 'oltp vs olap', 'olap vs oltp', 'oltp', 'data warehouse concepts', 'etl tools', 'etl tutorial', 'data warehousing', 'what is data warehouse', 'etl tutorial for beginners', 'etl data warehouse', 'etl tool', 'olap oltp', 'olap and oltp', 'difference between olap and oltp', 'data warehouse tutorial', 'etl pipeline', 'etl pipeline tutorial', 'etl tools for data engineer']",en,False,"Motivation, Technology Tips",UCh9nVJoWXmFb7sLApWGcLPQ,codebasics,2020-01-19T00:55:30Z,60.0
PLeo1K3hjS3ut55QHPU-0Tj-fNRDYdTHhp,9VQAwhp27eU,Data analyst interview tips | How to prepare for data analyst interview,2020-03-28T19:48:59Z,185300,5769,145,PT21M42S,hd,"['data analyst interview tips', 'data analyst interview questions and answers', 'data analyst interview preparation', 'data analyst interview introduction', 'data analyst interview presentation', 'interview data analyst', 'interview tips for data analyst', 'how to crack data analyst interview', 'data analyst interview', 'data analyst', 'data analytics interview questions', 'data analyst interview questions', 'analyst interview questions', 'interview questions for data analyst']",en,False,"Motivation, Technology Tips",UCh9nVJoWXmFb7sLApWGcLPQ,codebasics,2020-01-19T00:55:30Z,60.0
PLeo1K3hjS3ut55QHPU-0Tj-fNRDYdTHhp,CptrlyD0LJ8,How to learn coding for beginners | Learn coding for free | learn coding from scratch,2020-04-05T03:35:19Z,413891,9810,526,PT19M55S,hd,"['how to learn coding at home', 'how to learn coding for free', 'how to learn coding faster', 'learn programming for beginners', 'learn coding from scratch', 'learn coding for free', 'coding for beginners', 'how to learn coding for beginners', 'how to learn to code', 'learn coding for beginners', 'learn code', 'learn code fast', 'how to learn coding', 'how to learn programming for beginners', 'coding classes for beginners', 'free coding courses for beginners', 'basic coding for beginners', 'learn coding']",en,False,"Motivation, Technology Tips",UCh9nVJoWXmFb7sLApWGcLPQ,codebasics,2020-01-19T00:55:30Z,60.0
PLeo1K3hjS3ut55QHPU-0Tj-fNRDYdTHhp,rii6QRX8ZLs,Coding Best Practices With Examples | Code Review Best Practices,2020-04-17T22:15:10Z,45182,838,49,PT15M38S,hd,"['improve programming skills', 'code review best practices', 'coding best practices python', 'tips to perform better code review', 'tips to improve coding skills', 'how to improve coding skills', 'tips to perform better code', 'learn to code', 'programming', 'how to improve my code', 'how to improve my coding', 'computer science', 'how to become good coder', 'how to improve programming', 'how to improve programming skills', 'how to improve programming skills for beginners', 'improve programming with examples']",hi,False,"Motivation, Technology Tips",UCh9nVJoWXmFb7sLApWGcLPQ,codebasics,2020-01-19T00:55:30Z,60.0
PLeo1K3hjS3ut55QHPU-0Tj-fNRDYdTHhp,HT76DdBCIfU,Tips to improve programming skills,2020-04-25T19:17:07Z,14925,679,55,PT10M,hd,"['Tips to improve programming skills in 2020', 'improve coding skills', 'improve coding', 'how to improve coding skills', 'how to improve programming', 'becoming better at programming', 'how to improve programming skills', 'how to improve programming skills for beginners', 'tips to improve programming skills', 'skills for programming', 'improve logical skills for programming', 'programming skills for 2022', 'programming skills', 'coding skills for beginners', 'how to learn programming', 'learn programming']",hi,False,"Motivation, Technology Tips",UCh9nVJoWXmFb7sLApWGcLPQ,codebasics,2020-01-19T00:55:30Z,60.0
PLeo1K3hjS3ut55QHPU-0Tj-fNRDYdTHhp,yZFrSDjRvjk,How to learn anything effectively? | How to learn things effectively?,2020-04-30T22:25:09Z,154564,6774,182,PT4M24S,hd,"['how to learn anything fast', 'learn effectively', 'learn programming effectively', 'learn coding effectively', 'how to learn effectively', 'how to learn coding effectively', 'how to learn anything effectively', 'how to learn anything', 'effective learning', 'how to learn things effectively', 'how to learn anything easily', 'how to learn anything faster', 'how to learn anything 10x faster', 'characteristics of effective learning', 'help for effective learning', 'how to learn effective']",hi,False,"Motivation, Technology Tips",UCh9nVJoWXmFb7sLApWGcLPQ,codebasics,2020-01-19T00:55:30Z,60.0
PLeo1K3hjS3ut55QHPU-0Tj-fNRDYdTHhp,3qRu5R00y-4,Can anyone learn coding?,2020-05-06T02:07:32Z,22965,1040,124,PT6M54S,hd,"['Can anyone learn programming', 'learn programming', 'learn coding', 'can a non it person learn coding', 'can 10 th student learn coding', 'how to learn to code', 'coding', 'how to code', 'how i can learn coding', 'programming', 'how to learn coding for beginners', 'how to learn programming', 'how to teach yourself programming', 'how to learn programming for beginners', 'how to learn coding 2021', 'how to learn to code for beginners', 'how to learn code for beginners', 'can any one learn coding']",hi,False,"Motivation, Technology Tips",UCh9nVJoWXmFb7sLApWGcLPQ,codebasics,2020-01-19T00:55:30Z,60.0
PLeo1K3hjS3ut55QHPU-0Tj-fNRDYdTHhp,9fqu2m7O8VI,How to get programming experience without having a job | 5 Tips on getting real coding experience,2020-05-10T01:28:17Z,22498,898,54,PT16M21S,hd,"['get coding experience', 'get programming experience', 'software projects experience', 'how to get a software developer job without experience', 'gain technical experience', 'tips for software programmer job', 'how to get software programming job', 'gain experience without job', 'how to get a programming job', 'how to get a programming job with no experience', 'how to get a programming experience', 'how to get job with no experience', 'how to get a job with no experience', 'how to get work experience']",hi,False,"Motivation, Technology Tips",UCh9nVJoWXmFb7sLApWGcLPQ,codebasics,2020-01-19T00:55:30Z,60.0
PLeo1K3hjS3ut55QHPU-0Tj-fNRDYdTHhp,j8PnojuLnVo,3 Books that will help you become successful,2020-06-18T16:05:01Z,2824,155,32,PT19M3S,hd,"['books that help you become successful', 'codebasics most favorite books', 'books on self development', 'great motivational books']",en,False,"Motivation, Technology Tips",UCh9nVJoWXmFb7sLApWGcLPQ,codebasics,2020-01-19T00:55:30Z,60.0
PLeo1K3hjS3ut55QHPU-0Tj-fNRDYdTHhp,87PzGnEzCNc,How to earn money by coding | Make money by programming,2020-09-22T12:30:10Z,153051,5259,264,PT14M23S,hd,"['earn money coding', 'make money programming', 'how to make money coding', 'make money coding', 'make money with coding', 'make money coding from home', 'how to earn money by coding', 'how to make money from coding', 'how to make money with coding', 'how to earn by coding', 'money coding', 'coding jobs from home', 'how to earn from coding', 'make money from coding', 'how to earn money from coding', 'how to make money as a programmer', 'ways to make money coding', 'practical ways to make money coding']",en,False,"Motivation, Technology Tips",UCh9nVJoWXmFb7sLApWGcLPQ,codebasics,2020-01-19T00:55:30Z,60.0
PLeo1K3hjS3ut55QHPU-0Tj-fNRDYdTHhp,4xh1Vek9vnk,How to build logic in programming | Tips to improving logic building in programming,2020-10-03T13:30:09Z,45031,1708,120,PT16M12S,hd,"['how to build logic skills in programming', 'how to build logic in programming language', 'tips to improving logic building in programming', 'competitive programming', 'logic building in programming', 'how to get better at programming logic', 'learn coding', 'coding basics', 'logic building', 'programming', '5 tips to improve logic building in programming', 'how to improve logic building in programming', 'how to improve logic building']",en,False,"Motivation, Technology Tips",UCh9nVJoWXmFb7sLApWGcLPQ,codebasics,2020-01-19T00:55:30Z,60.0
PLeo1K3hjS3ut55QHPU-0Tj-fNRDYdTHhp,cXBK_G5M1Ng,How to become industry ready when you are in college,2020-10-06T12:30:10Z,6604,455,70,PT23M27S,hd,"['how to become industry ready', 'advice for college students', 'advice for college grades', 'advice for college graduates', 'advice for college seniors', 'advice for college graduates looking for a job', 'best career advice for new graduates', 'college advice', 'career advice for college students', 'career advice', 'industry ready', 'coding interview', 'programming interview', 'computer science', 'software development', 'how to improve your coding skills', 'how to improve your coding logic']",en,False,"Motivation, Technology Tips",UCh9nVJoWXmFb7sLApWGcLPQ,codebasics,2020-01-19T00:55:30Z,60.0
PLeo1K3hjS3ut55QHPU-0Tj-fNRDYdTHhp,ZajwOKbY3XU,How to ask technical questions in a right way?,2020-10-11T13:30:09Z,2045,138,46,PT9M20S,hd,"['how to ask technical questions', 'ask technical help', 'software developer', 'software engineer', 'software development', 'software engineering', 'information technology', 'engineering', 'technical question', 'how to ask technical question', 'coding interview questions and answers', 'computer science', 'how to ask computer questions', 'how to ask programming questions', 'programming']",en,False,"Motivation, Technology Tips",UCh9nVJoWXmFb7sLApWGcLPQ,codebasics,2020-01-19T00:55:30Z,60.0
PLeo1K3hjS3ut55QHPU-0Tj-fNRDYdTHhp,H4YcqULY1-Q,Step by step roadmap to learn data science in 6 months |  Complete data science roadmap,2020-10-17T13:30:12Z,691089,26610,1204,PT30M42S,hd,"['data science roadmap', 'learn data science smartly', 'learn data science step by step', 'data scientist learning path', 'how to learn data science smartly', 'data science roadmap 2021', 'complete data science roadmap', 'data science roadmap 2022', 'road map to data scientist', 'data science full course', 'data science for beginners', 'how to start data science learning', 'how to learn data science', 'how to become data scientist', 'how to start data science learning for beginners', 'data science tutorial']",en,False,"Motivation, Technology Tips",UCh9nVJoWXmFb7sLApWGcLPQ,codebasics,2020-01-19T00:55:30Z,60.0
PLeo1K3hjS3ut55QHPU-0Tj-fNRDYdTHhp,e4i_EGAa0gU,How to get a job after learning data science skills,2020-10-25T15:30:11Z,45857,1703,105,PT15M30S,hd,"['yt:cc=on', 'how to get a job as data scientist', 'how to get a job as a freshman', 'how to get a job as a fresher', 'how to get data scientist job as a fresher', 'data science', 'data analyst job', 'how to become a data scientist', 'data scientist job', 'How to get data scientist job', 'data scientist jobs tips', 'data scientist career', 'data scientist job tips', 'data science job tips', 'data science career tips']",en,False,"Motivation, Technology Tips",UCh9nVJoWXmFb7sLApWGcLPQ,codebasics,2020-01-19T00:55:30Z,60.0
PLeo1K3hjS3ut55QHPU-0Tj-fNRDYdTHhp,YCgJ2wqJT0A,"AI will kill all jobs in this world, really?",2020-11-24T13:30:09Z,22222,865,163,PT8M24S,hd,"['yt:cc=on', 'artificial intelligence', 'data science', 'ai', 'artificial intelligence robot', 'the future of', 'AI will kill all jobs', 'machine learning', 'deep learning', 'ai jobs', 'automation', 'will automation take away all our jobs', 'ai takeover', 'automation will kill jobs']",en,False,"Motivation, Technology Tips",UCh9nVJoWXmFb7sLApWGcLPQ,codebasics,2020-01-19T00:55:30Z,60.0
PLeo1K3hjS3ut55QHPU-0Tj-fNRDYdTHhp,_eAl7vuVu3U,"Learn data analytics skills in 3 months, step by step | Complete data analyst roadmap in 2022",2020-11-25T13:30:09Z,1497105,52989,1374,PT18M49S,hd,"['how to learn data analyst skills', 'data analyst skills', 'how to become a data analyst', 'how to become data analyst', 'data analyst for beginners', 'how to learn data analyst', 'learn data analyst', 'data analyst roadmap', 'complete data analyst roadmap', 'data analyst guide', 'data analyst', 'data analyst course', 'data analyst full course', 'learn data analytics', 'data analyst beginner', 'data analyst road map', 'how to be a data analyst', 'data analyst roadmap 2022', 'roadmap for data analyst']",en,False,"Motivation, Technology Tips",UCh9nVJoWXmFb7sLApWGcLPQ,codebasics,2020-01-19T00:55:30Z,60.0
PLeo1K3hjS3ut55QHPU-0Tj-fNRDYdTHhp,QC2d2jmdbPM,Can anyone learn coding? | How to learn coding faster?,2020-12-26T15:00:11Z,9693,550,102,PT8M4S,hd,"['yt:cc=on', 'coding', 'learn to code', 'how to learn to code', 'how to learn to code for beginners', 'how to learn to code fast', 'how to learn programming for beginners', 'learning programming', 'learn coding', 'best way to learn programming', 'best way to learn coding', 'programming', 'learn programming', 'how to learn programming', 'coding for beginners', 'programming for for beginners', 'how to learn coding']",en,False,"Motivation, Technology Tips",UCh9nVJoWXmFb7sLApWGcLPQ,codebasics,2020-01-19T00:55:30Z,60.0
PLeo1K3hjS3ut55QHPU-0Tj-fNRDYdTHhp,VNmghbJRv8I,Top 5 Programming Languages To Learn in 2021,2020-12-27T16:00:13Z,98160,1400,269,PT18M58S,hd,"['yt:cc=on', 'top 5 programming language to learn in 2021', 'top 5 programming languages 2021', 'programming languages 2021', 'best programming language to learn 2021', 'top languages to learn in 2021', 'best programming language 2021', 'programming language 2021', 'top 5 languages to learn in 2021', 'languages to learn in 2021', 'programming language to learn in 2021', 'most popular programming languages', 'best programming languages', 'best programming language']",en,False,"Motivation, Technology Tips",UCh9nVJoWXmFb7sLApWGcLPQ,codebasics,2020-01-19T00:55:30Z,60.0
PLeo1K3hjS3ut55QHPU-0Tj-fNRDYdTHhp,FtONvNGAJYk,Should you switch to Polar from Pandas?  #dataanalytics #datascience #data #shorts,2023-08-21T12:30:09Z,20708,955,14,PT42S,hd,"['yt:cc=on', 'data anlaytics', 'data science', 'data', 'polar', 'python', 'tech tip', 'pandas', 'pandas vs polar']",en,False,"Motivation, Technology Tips",UCh9nVJoWXmFb7sLApWGcLPQ,codebasics,2020-01-19T00:55:30Z,60.0
PLeo1K3hjS3ut55QHPU-0Tj-fNRDYdTHhp,p5lPAxM0VRY,Top 5 BI Tools in Market! ðŸ“Š  #dataanalytics #data #datascience #shorts,2023-08-22T12:42:09Z,9354,418,10,PT40S,hd,"['yt:cc=on', 'bi tools', 'top bi tools', 'powerbi', 'tableu', 'data anlaysis', 'data science']",en,False,"Motivation, Technology Tips",UCh9nVJoWXmFb7sLApWGcLPQ,codebasics,2020-01-19T00:55:30Z,60.0
PLeo1K3hjS3ut55QHPU-0Tj-fNRDYdTHhp,7r5rqK7GHEY,Don't ignore this if you are building a dashboard! ðŸ“Šâœ  #dataanalytics #datascience #data #shorts,2023-08-24T12:30:03Z,19946,1314,10,PT30S,hd,"['yt:cc=on', 'mockups', 'dashboard', 'power bi', 'data anlayst', 'data science', 'tech tip', 'stakeholders management']",en,False,"Motivation, Technology Tips",UCh9nVJoWXmFb7sLApWGcLPQ,codebasics,2020-01-19T00:55:30Z,60.0
PLeo1K3hjS3ut55QHPU-0Tj-fNRDYdTHhp,tI7EZNjRHdE,Power BI DAX Tip | Graceful Division âž—ðŸ’¡  #dataanalysis #investing #data #shorts,2023-08-26T12:30:36Z,3577,222,7,PT41S,hd,"['yt:cc=on', 'shorts', 'data analyst', 'data science', 'data', 'power bi tip', 'graceful division']",en,False,"Motivation, Technology Tips",UCh9nVJoWXmFb7sLApWGcLPQ,codebasics,2020-01-19T00:55:30Z,60.0
PLeo1K3hjS3ut55QHPU-0Tj-fNRDYdTHhp,AIzjiGlwr5I,Search Skill OR Memorization Skill? ðŸ˜• #dataanalysis #datascience #data #shorts,2023-08-28T00:30:03Z,11612,1016,25,PT44S,hd,"['yt:cc=on', 'googling skill', 'searching skill', 'career tip', 'shorts']",en,False,"Motivation, Technology Tips",UCh9nVJoWXmFb7sLApWGcLPQ,codebasics,2020-01-19T00:55:30Z,60.0
PLeo1K3hjS3ut55QHPU-0Tj-fNRDYdTHhp,RmpuqY8_ZLw,5 Ways SQL is used in Data Industry! #dataanalysis #datascience #data #shorts,2023-08-30T12:30:11Z,14635,1158,9,PT51S,hd,"['sql', 'data insustry', 'data science', 'data analyst', 'sql tips', 'sql for data field']",en,False,"Motivation, Technology Tips",UCh9nVJoWXmFb7sLApWGcLPQ,codebasics,2020-01-19T00:55:30Z,60.0
PLeo1K3hjS3ut55QHPU-0Tj-fNRDYdTHhp,b6gnP72mlyw,Langchain for LLMs! ðŸ¦œðŸ’¡ #codebasics #shorts #dataanalysis #data,2023-09-06T12:30:17Z,4640,319,7,PT33S,hd,"['langchain', 'LLM', 'large language models', 'AI', 'API', 'chatgpt', 'gpt 3', 'gpt 4']",en,False,"Motivation, Technology Tips",UCh9nVJoWXmFb7sLApWGcLPQ,codebasics,2020-01-19T00:55:30Z,60.0
PLeo1K3hjS3ut55QHPU-0Tj-fNRDYdTHhp,wNbq6DxFcwU,15 Design Rules for BI Dashboard! ðŸ“ŠðŸŒŸ #codebasics #shorts #dataanalysis #data,2023-09-10T12:30:36Z,9386,1139,12,PT28S,hd,,en,False,"Motivation, Technology Tips",UCh9nVJoWXmFb7sLApWGcLPQ,codebasics,2020-01-19T00:55:30Z,60.0
PLeo1K3hjS3ut55QHPU-0Tj-fNRDYdTHhp,IoHEuhPPwRA,Art of Asking Questions!ðŸŽ¨ðŸ’¡ #codebasics #shorts #dataanalysis #data,2023-09-14T12:30:19Z,10404,537,7,PT36S,hd,"['career help', 'art of questioning', 'how to get help at work', 'career tip', 'workplace help', 'workplace tip']",en,False,"Motivation, Technology Tips",UCh9nVJoWXmFb7sLApWGcLPQ,codebasics,2020-01-19T00:55:30Z,60.0
PLeo1K3hjS3ut55QHPU-0Tj-fNRDYdTHhp,kfjH9nHve-8,This Attitude YOU NEED in Data Field! ðŸ“ˆâœ… #codebasics #shorts #dataanalysis #data,2023-09-15T12:30:24Z,52385,3165,36,PT55S,hd,"['career tip', 'problem solver', 'art of getting help', 'get help']",en,False,"Motivation, Technology Tips",UCh9nVJoWXmFb7sLApWGcLPQ,codebasics,2020-01-19T00:55:30Z,60.0
PLeo1K3hjS3ut55QHPU-0Tj-fNRDYdTHhp,vk1B1TmTmqg,Not Getting an Interview Call?ðŸ˜• #codebasics #shorts #dataanalysis #data,2023-09-16T12:30:24Z,13257,1291,14,PT45S,hd,"['data career jobs', 'interview checklist', 'online credebility', 'linkedin tip', 'linkedin profile optimization']",en,False,"Motivation, Technology Tips",UCh9nVJoWXmFb7sLApWGcLPQ,codebasics,2020-01-19T00:55:30Z,60.0
PLeo1K3hjS3ut55QHPU-0Tj-fNRDYdTHhp,z4PkyYd7FUI,6 Ways to SPEED UP Python Program! ðŸŽðŸ’¨#codebasics #shorts #dataanalysis #data,2023-09-17T12:30:28Z,11841,1137,1,PT57S,hd,"['python tip', 'python speed up', 'quick python coding', 'faster python coding']",en,False,"Motivation, Technology Tips",UCh9nVJoWXmFb7sLApWGcLPQ,codebasics,2020-01-19T00:55:30Z,60.0
PLeo1K3hjS3ut55QHPU-0Tj-fNRDYdTHhp,53nrpoqMpbw,Use this tip to learn anything fast! âš¡ðŸ’¡#codebasics #shorts #dataanalysis #data,2023-09-18T12:30:05Z,9156,730,12,PT32S,hd,"['quick learning tips', 'how to learn anything faster', 'faster learning', 'kung fu panda']",en,False,"Motivation, Technology Tips",UCh9nVJoWXmFb7sLApWGcLPQ,codebasics,2020-01-19T00:55:30Z,60.0
PLeo1K3hjS3ut55QHPU-0Tj-fNRDYdTHhp,qrIhx8Aeef4,12 Best Practices For Data Analytics Project! ðŸ“ŠðŸ’¡,2023-10-04T13:30:10Z,17955,488,23,PT9M56S,hd,"['yt:cc=on', 'data analytics practices', 'data analytics career tips', 'data career hack', 'career hacks']",en,False,"Motivation, Technology Tips",UCh9nVJoWXmFb7sLApWGcLPQ,codebasics,2020-01-19T00:55:30Z,60.0
PLeo1K3hjS3ut55QHPU-0Tj-fNRDYdTHhp,E-ech-D96V4,Data Visualization Tip: Start with 0 ðŸ’¡ #codebasics #shorts #dataanalysis #data,2023-09-20T12:30:13Z,14297,1120,6,PT40S,hd,"['data analysis tip', 'data visualization tip', 'data career tip', 'career tip', 'career hack', 'visualization hack']",en,False,"Motivation, Technology Tips",UCh9nVJoWXmFb7sLApWGcLPQ,codebasics,2020-01-19T00:55:30Z,60.0
PLeo1K3hjS3ut55QHPU-0Tj-fNRDYdTHhp,px0Oz0nRz4c,He cracked 10 Interviews..! ðŸ¤¯#codebasics #shorts #dataanalysis #data,2023-09-21T12:30:28Z,27245,1961,18,PT42S,hd,"['tech companies interview', 'how to crack big interviews', 'how to crack any interview', 'interview hacks', 'interview tips', 'big tech companies', 'meta', 'facebook', 'uber', 'affirm', 'microft', 'facebook interview cracked']",en,False,"Motivation, Technology Tips",UCh9nVJoWXmFb7sLApWGcLPQ,codebasics,2020-01-19T00:55:30Z,60.0
PLeo1K3hjS3ut55QHPU-0Tj-fNRDYdTHhp,tLsQx-3HeQI,75 CODING QUESTIONS For Your Interview! ðŸ“ðŸ’¡#codebasics #shorts #dataanalysis #data,2023-09-22T12:30:38Z,15221,1866,29,PT34S,hd,"['coding questions', 'coding interview questions', 'interview questions']",en,False,"Motivation, Technology Tips",UCh9nVJoWXmFb7sLApWGcLPQ,codebasics,2020-01-19T00:55:30Z,60.0
PLeo1K3hjS3ut55QHPU-0Tj-fNRDYdTHhp,k1Zkg4uwlIc,Functional DashboardðŸŒ¹ vs. Fancy DashboardðŸ“Š? #codebasics #shorts #dataanalysis #data,2023-09-23T12:30:33Z,15908,941,3,PT48S,hd,"['dashboarding tips', 'fancy dashboard', 'functional dashboard']",en,False,"Motivation, Technology Tips",UCh9nVJoWXmFb7sLApWGcLPQ,codebasics,2020-01-19T00:55:30Z,60.0
PLeo1K3hjS3ut55QHPU-0Tj-fNRDYdTHhp,huWr4E88ZoI,8 Portals for DatasetsðŸ¤¯#codebasics #shorts #dataanalysis #data,2023-09-24T12:30:33Z,15222,2428,13,PT47S,hd,"['free datasets', 'free data resources', 'data resources for beginners']",en,False,"Motivation, Technology Tips",UCh9nVJoWXmFb7sLApWGcLPQ,codebasics,2020-01-19T00:55:30Z,60.0
PLeo1K3hjS3ut55QHPU-0Tj-fNRDYdTHhp,s-vNTTr_jFI,Data Visualization Tip: Ribbon Chart ðŸ’¡ðŸ“Š #codebasics #shorts #dataanalysis #data,2023-09-25T12:30:36Z,7998,549,4,PT40S,hd,"['data analytics tip', 'dashboarding tip', 'ribbon charts']",en,False,"Motivation, Technology Tips",UCh9nVJoWXmFb7sLApWGcLPQ,codebasics,2020-01-19T00:55:30Z,60.0
PLeo1K3hjS3ut55QHPU-0Tj-fNRDYdTHhp,ROcFzxXm6hE,Health Struggle ðŸ‘¨â€âš•ï¸ Helped me Grow my YouTube ChannelðŸŽ¥ ðŸ“ˆ#codebasics #shorts #dataanalysis #data,2023-10-02T12:30:15Z,21708,2060,63,PT53S,hd,"['health issues', 'health struggle', 'my youtube journey', 'how i grew my youtube', 'life lesson', 'ikigai', 'passion', 'ed tech channel', 'codebasics']",en,False,"Motivation, Technology Tips",UCh9nVJoWXmFb7sLApWGcLPQ,codebasics,2020-01-19T00:55:30Z,60.0
PLeo1K3hjS3ut55QHPU-0Tj-fNRDYdTHhp,WkBFJjUIeOE,ChatGPT New Update: Text and Audio Support,2023-09-27T16:20:36Z,51927,411,49,PT6M8S,hd,"['yt:cc=on', 'chatgpt image', 'chatgpt audio', 'chatgpt latest update']",en,False,"Motivation, Technology Tips",UCh9nVJoWXmFb7sLApWGcLPQ,codebasics,2020-01-19T00:55:30Z,60.0
PLeo1K3hjS3ut55QHPU-0Tj-fNRDYdTHhp,20US5sfG-j8,Now ChatGPT can Read and Hear!!! ðŸ¤©ðŸ«¡#codebasics #shorts #dataanalysis #data,2023-09-29T12:30:01Z,17400,596,5,PT33S,hd,"['chatgpt', 'chatgpt new updates', 'chatgpt new features', 'how to use chatgpt', 'chatgpt tutorial', 'chatgpt image', 'image with chatgpt', 'chatgpt strategy']",en,False,"Motivation, Technology Tips",UCh9nVJoWXmFb7sLApWGcLPQ,codebasics,2020-01-19T00:55:30Z,60.0
PLeo1K3hjS3ut55QHPU-0Tj-fNRDYdTHhp,s6lRU0nn_nw,Data Visualization Tip: Pie Chart vs Bar Chart ðŸ’¡ðŸ“Š #codebasics #shorts #dataanalysis #data,2023-10-05T12:30:33Z,7354,572,6,PT25S,hd,"['data analytics tip', 'dashboarding tip', 'types of charts', 'pie charts', 'bar charts', 'power bi']",en,False,"Motivation, Technology Tips",UCh9nVJoWXmFb7sLApWGcLPQ,codebasics,2020-01-19T00:55:30Z,60.0
PLeo1K3hjS3ut55QHPU-0Tj-fNRDYdTHhp,NNFZ8uuvmUQ,Data Visualization Tip: Include Context ðŸ“Š #codebasics #shorts #dataanalysis #data,2023-10-09T12:30:12Z,2711,151,2,PT20S,hd,"['data visualization', 'dashboarding tip', 'data visualization tip', 'include context', 'data analysis', 'data analytics', 'data science']",en,False,"Motivation, Technology Tips",UCh9nVJoWXmFb7sLApWGcLPQ,codebasics,2020-01-19T00:55:30Z,60.0
PLeo1K3hjS3ut55QHPU-0Tj-fNRDYdTHhp,p_LdvnTUtvM,Do this thing to get a tech job! ðŸ¤©#codebasics #shorts #dataanalysis #data #dataanalytics,2023-10-12T12:30:26Z,4805,326,0,PT19S,hd,"['practicing', 'career tip', 'practice over learning only', 'learning with practice', 'job help']",en,False,"Motivation, Technology Tips",UCh9nVJoWXmFb7sLApWGcLPQ,codebasics,2020-01-19T00:55:30Z,60.0
PLeo1K3hjS3ut55QHPU-0Tj-fNRDYdTHhp,qpkYgvSmDmw,The Only Math needed for a Data Analyst role! #codebasics #shorts #dataanalysis #data #dataanalytics,2023-10-13T12:30:25Z,10460,1129,12,PT28S,hd,"['business maths', 'maths', 'mathematics for career', 'mathematics for data analyst jobs', 'data analyst jobs']",en,False,"Motivation, Technology Tips",UCh9nVJoWXmFb7sLApWGcLPQ,codebasics,2020-01-19T00:55:30Z,60.0
PLeo1K3hjS3ut55QHPU-0Tj-fNRDYdTHhp,oqzmJ1QQ4hE,This is more important than the formal education! ðŸ¤« #shorts #dataanalysis #data #dataanalytics,2023-10-14T12:30:34Z,3506,223,8,PT35S,hd,"['formal education', 'skill upgrade', 'upgrading yourself', 'practice', 'practicing']",en,False,"Motivation, Technology Tips",UCh9nVJoWXmFb7sLApWGcLPQ,codebasics,2020-01-19T00:55:30Z,60.0
PLeo1K3hjS3ut55QHPU-0Tj-fNRDYdTHhp,YhiiJ3vWG-s,Top KPIs for Data Analyst Career! ðŸ“ˆðŸ¤©#codebasics #shorts #dataanalysis #data #dataanalytics,2023-10-16T12:30:20Z,8808,881,6,PT18S,hd,"['KPIs', 'KPI', 'what is KPI', 'best KPIs for DATA jobs', 'business knowledge', 'business understanding', 'kpis for business understanding']",en,False,"Motivation, Technology Tips",UCh9nVJoWXmFb7sLApWGcLPQ,codebasics,2020-01-19T00:55:30Z,60.0
PLeo1K3hjS3ut55QHPU-0Tj-fNRDYdTHhp,WcxvKYknRU0,DO NOT WORK HARD!âœ‹ðŸš« #codebasics #shorts #dataanalysis #data #dataanalytics,2023-10-18T12:30:27Z,5508,299,2,PT26S,hd,"['hard work', 'do not work hard', 'smart work vs hard work']",en,False,"Motivation, Technology Tips",UCh9nVJoWXmFb7sLApWGcLPQ,codebasics,2020-01-19T00:55:30Z,60.0
PLeo1K3hjS3ut55QHPU-0Tj-fNRDYdTHhp,5v402p6ydjw,Super Effective Way to Build Soft Skills! ðŸ¦¸ðŸ¤©#codebasics #shorts #dataanalysis #data #dataanalytics,2023-10-22T12:30:04Z,5431,473,1,PT19S,hd,"['soft skills', 'core skills', 'how to improve soft skills', 'how to improve core skills']",en,False,"Motivation, Technology Tips",UCh9nVJoWXmFb7sLApWGcLPQ,codebasics,2020-01-19T00:55:30Z,60.0
