playlist_id,video_id,title,published,view_count,like_count,comment_count,duration,definition,tags,default_audio_language,madeforkid,playlist_title,channel_id,channelTitle,playlist_published,playlist_numvideo
PLjgj6kdf_snbrEI-BgJh36tNcemL2kdbS,DpFaWTZAfuc,1. Introduction to Large Language Models with GPT & LangChain - AI Code Along,2023-11-30T09:36:26Z,618,17,0,PT48M8S,hd,"['ai', 'code along', 'gpt', 'langchain', 'openai', 'pinecone', 'huggingface']",en,False,NEW: Become an AI Developer Code Along Series,UC79Gv3mYp6zKiSwYemEik9A,DataCamp,2023-11-30T09:36:08Z,9
PLjgj6kdf_snbrEI-BgJh36tNcemL2kdbS,luRtEpFuwXA,2. Prompt Engineering with GPT & LangChain - AI Code Along,2023-11-30T09:37:17Z,192,5,0,PT1H36M45S,hd,"['ai', 'code along', 'gpt', 'langchain', 'openai', 'pinecone', 'huggingface']",en,False,NEW: Become an AI Developer Code Along Series,UC79Gv3mYp6zKiSwYemEik9A,DataCamp,2023-11-30T09:36:08Z,9
PLjgj6kdf_snbrEI-BgJh36tNcemL2kdbS,8_j3-Sx7nwk,3. Building Multimodal AI Applications with LangChain & the OpenAI API - AI Code Along,2023-11-30T09:38:15Z,41,1,0,PT28M40S,hd,"['ai', 'code along', 'gpt', 'langchain', 'openai', 'pinecone', 'huggingface']",en,False,NEW: Become an AI Developer Code Along Series,UC79Gv3mYp6zKiSwYemEik9A,DataCamp,2023-11-30T09:36:08Z,9
PLjgj6kdf_snbrEI-BgJh36tNcemL2kdbS,7d9ZTlhkL1o,4. Semantic Search with Pinecone - AI Code Along,2023-11-30T09:39:20Z,8,0,0,PT51M12S,hd,"['ai', 'code along', 'gpt', 'langchain', 'openai', 'pinecone', 'huggingface']",en,False,NEW: Become an AI Developer Code Along Series,UC79Gv3mYp6zKiSwYemEik9A,DataCamp,2023-11-30T09:36:08Z,9
PLjgj6kdf_snbEmJ9n-9ch0iUPb8ehkPNm,uCBtA-RjVu0,Using AI in Robotics,2023-11-23T05:11:04Z,466,29,1,PT1H9M4S,hd,,en,False,Live Webinars,UC79Gv3mYp6zKiSwYemEik9A,DataCamp,2023-11-23T11:11:08Z,28
PLjgj6kdf_snbEmJ9n-9ch0iUPb8ehkPNm,SmSoTa5eRZA,Revolutionizing Decision Making using AI,2023-11-17T05:14:06Z,484,23,0,PT1H8M22S,hd,,en,False,Live Webinars,UC79Gv3mYp6zKiSwYemEik9A,DataCamp,2023-11-23T11:11:08Z,28
PLjgj6kdf_snbEmJ9n-9ch0iUPb8ehkPNm,SxJqyatlmTs,"GPT-4 Turbo, Custom GPTs & the Assistants API",2023-11-16T05:06:43Z,1232,42,0,PT1H2M16S,hd,,en,False,Live Webinars,UC79Gv3mYp6zKiSwYemEik9A,DataCamp,2023-11-23T11:11:08Z,28
PLjgj6kdf_snbEmJ9n-9ch0iUPb8ehkPNm,lZnSq61e0wk,A High-Level Approach for Solving MLOps Challenges,2023-11-10T05:08:22Z,365,16,0,PT1H7M,hd,,en,False,Live Webinars,UC79Gv3mYp6zKiSwYemEik9A,DataCamp,2023-11-23T11:11:08Z,28
PLjgj6kdf_snbEmJ9n-9ch0iUPb8ehkPNm,RfMlJ8Xh36Q,Advanced ChatGPT Prompt Engineering,2023-11-02T04:22:21Z,1130,52,9,PT1H6M25S,hd,,en,False,Live Webinars,UC79Gv3mYp6zKiSwYemEik9A,DataCamp,2023-11-23T11:11:08Z,28
PLjgj6kdf_snbEmJ9n-9ch0iUPb8ehkPNm,KEEGJGhj-FY,Driving Learning Engagement with Community and AI,2023-10-27T04:00:40Z,221,18,0,PT1H2M20S,hd,,en,False,Live Webinars,UC79Gv3mYp6zKiSwYemEik9A,DataCamp,2023-11-23T11:11:08Z,28
PLjgj6kdf_snbEmJ9n-9ch0iUPb8ehkPNm,dqJApFjoMUI,AI for Visual Data: Computer Vision in Business,2023-10-26T04:11:24Z,402,15,0,PT1H10M18S,hd,,en,False,Live Webinars,UC79Gv3mYp6zKiSwYemEik9A,DataCamp,2023-11-23T11:11:08Z,28
PLjgj6kdf_snbEmJ9n-9ch0iUPb8ehkPNm,jAT2vtmWnq0,Building a Capability Roadmap for AI,2023-10-20T04:02:28Z,625,25,1,PT1H3M28S,hd,,en,False,Live Webinars,UC79Gv3mYp6zKiSwYemEik9A,DataCamp,2023-11-23T11:11:08Z,28
PLjgj6kdf_snbEmJ9n-9ch0iUPb8ehkPNm,oVazRL-bU7M,Best Practices for Developing Generative AI Products,2023-10-19T04:05:06Z,440,17,0,PT1H5M1S,hd,,en,False,Live Webinars,UC79Gv3mYp6zKiSwYemEik9A,DataCamp,2023-11-23T11:11:08Z,28
PLjgj6kdf_snbEmJ9n-9ch0iUPb8ehkPNm,eQBxZxrdCTE,Best Practices for Hiring Data Scientists,2023-10-06T04:09:53Z,693,31,1,PT1H7M6S,hd,,en,False,Live Webinars,UC79Gv3mYp6zKiSwYemEik9A,DataCamp,2023-11-23T11:11:08Z,28
PLjgj6kdf_snbEmJ9n-9ch0iUPb8ehkPNm,iONOdQNuJYk,What ChatGPT Enterprise Means for Your Organization,2023-09-14T04:42:57Z,883,14,4,PT53M23S,hd,,en,False,Live Webinars,UC79Gv3mYp6zKiSwYemEik9A,DataCamp,2023-11-23T11:11:08Z,28
PLjgj6kdf_snbEmJ9n-9ch0iUPb8ehkPNm,caEHv4dFn9g,Effective Data Storytelling for Financial Services,2023-09-13T05:20:28Z,832,27,0,PT1H13M56S,hd,,en,False,Live Webinars,UC79Gv3mYp6zKiSwYemEik9A,DataCamp,2023-11-23T11:11:08Z,28
PLjgj6kdf_snbEmJ9n-9ch0iUPb8ehkPNm,3kpWWlEP9m0,Making Decisions with Data & AI,2023-09-08T04:34:57Z,1297,49,1,PT1H1M57S,hd,,en,False,Live Webinars,UC79Gv3mYp6zKiSwYemEik9A,DataCamp,2023-11-23T11:11:08Z,28
PLjgj6kdf_snbEmJ9n-9ch0iUPb8ehkPNm,nXRYVgXmZ5k,DataCamp Classrooms Orientation Autumn 2023,2023-09-07T04:09:14Z,418,8,0,PT1H6M49S,hd,,en,False,Live Webinars,UC79Gv3mYp6zKiSwYemEik9A,DataCamp,2023-11-23T11:11:08Z,28
PLjgj6kdf_snbEmJ9n-9ch0iUPb8ehkPNm,tCpDTPnP_YU,Empowering Government with Data & AI Literacy,2023-09-06T04:04:58Z,586,6,0,PT1H5M20S,hd,,en,False,Live Webinars,UC79Gv3mYp6zKiSwYemEik9A,DataCamp,2023-11-23T11:11:08Z,28
PLjgj6kdf_snbEmJ9n-9ch0iUPb8ehkPNm,S9wxzYOyiO4,Organizational Data Competency,2023-09-01T04:10:03Z,361,15,0,PT1H8M25S,hd,,en,False,Live Webinars,UC79Gv3mYp6zKiSwYemEik9A,DataCamp,2023-11-23T11:11:08Z,28
PLjgj6kdf_snbEmJ9n-9ch0iUPb8ehkPNm,Eusrf2yNffY,Accelerating Your Data Career with DataCamp Portfolio,2023-08-30T03:58:12Z,856,44,1,PT57M18S,hd,,en,False,Live Webinars,UC79Gv3mYp6zKiSwYemEik9A,DataCamp,2023-11-23T11:11:08Z,28
PLjgj6kdf_snbEmJ9n-9ch0iUPb8ehkPNm,XGvt355PgL0,Getting ROI from AI,2023-08-25T08:21:45Z,647,27,1,PT1H12M6S,hd,,en,False,Live Webinars,UC79Gv3mYp6zKiSwYemEik9A,DataCamp,2023-11-23T11:11:08Z,28
PLjgj6kdf_snbEmJ9n-9ch0iUPb8ehkPNm,aUp7Q_9vh_Y,Data Science in the Energy Industry,2023-08-24T04:17:27Z,849,36,0,PT1H15M32S,hd,,en,False,Live Webinars,UC79Gv3mYp6zKiSwYemEik9A,DataCamp,2023-11-23T11:11:08Z,28
PLjgj6kdf_snbEmJ9n-9ch0iUPb8ehkPNm,tKiBw2d_RLg,Utilizing Public Data Effectively,2023-08-17T04:05:59Z,558,25,0,PT1H3M41S,hd,,en,False,Live Webinars,UC79Gv3mYp6zKiSwYemEik9A,DataCamp,2023-11-23T11:11:08Z,28
PLjgj6kdf_snbEmJ9n-9ch0iUPb8ehkPNm,6AjJhD2MPNc,Using Workspace in the Classroom,2023-08-12T02:56:52Z,415,13,1,PT50M38S,hd,,en,False,Live Webinars,UC79Gv3mYp6zKiSwYemEik9A,DataCamp,2023-11-23T11:11:08Z,28
PLjgj6kdf_snbEmJ9n-9ch0iUPb8ehkPNm,PXNFnTBD1Sk,Driving AI Literacy in Organizations,2023-08-11T04:10:16Z,539,10,1,PT1H6M5S,hd,,en,False,Live Webinars,UC79Gv3mYp6zKiSwYemEik9A,DataCamp,2023-11-23T11:11:08Z,28
PLjgj6kdf_snbEmJ9n-9ch0iUPb8ehkPNm,ddZY8kJN_ss,A More Human Future in the Era of AI,2023-08-04T04:09:05Z,407,16,0,PT1H4M30S,hd,,en,False,Live Webinars,UC79Gv3mYp6zKiSwYemEik9A,DataCamp,2023-11-23T11:11:08Z,28
PLjgj6kdf_snbEmJ9n-9ch0iUPb8ehkPNm,lL17l2xO-EQ,New Dimensions x DataCamp Donates: Empowering Women in Ecuador with Data Literacy,2023-08-03T04:03:50Z,292,13,3,PT1H2M58S,hd,,en,False,Live Webinars,UC79Gv3mYp6zKiSwYemEik9A,DataCamp,2023-11-23T11:11:08Z,28
PLjgj6kdf_snbEmJ9n-9ch0iUPb8ehkPNm,T1pgfTBtrlc,Buy or Train? Using Large Language Models in the Enterprise,2023-07-28T04:03:41Z,596,33,1,PT1H3M26S,hd,,en,False,Live Webinars,UC79Gv3mYp6zKiSwYemEik9A,DataCamp,2023-11-23T11:11:08Z,28
PLjgj6kdf_snbEmJ9n-9ch0iUPb8ehkPNm,uJx4evM991s,How Specsavers Upskilled Their Data Teams,2023-07-21T04:10:39Z,249,6,0,PT55M15S,hd,,en,False,Live Webinars,UC79Gv3mYp6zKiSwYemEik9A,DataCamp,2023-11-23T11:11:08Z,28
PLjgj6kdf_snbEmJ9n-9ch0iUPb8ehkPNm,XpFE4oZcTN4,Responsible AI: Evaluating Machine Learning Models in Python,2023-07-19T04:09:23Z,739,49,1,PT1H7M39S,hd,,en-US,False,Live Webinars,UC79Gv3mYp6zKiSwYemEik9A,DataCamp,2023-11-23T11:11:08Z,28
PLjgj6kdf_snbEmJ9n-9ch0iUPb8ehkPNm,MBauGQDuHUk,Unleash the Power and Profit of a Data + People Strategy,2023-07-14T04:05:10Z,454,17,0,PT1H3M3S,hd,,en-US,False,Live Webinars,UC79Gv3mYp6zKiSwYemEik9A,DataCamp,2023-11-23T11:11:08Z,28
PLjgj6kdf_snYc7OjL3P-QnUorZHBsTqMJ,uafoCRsZ8uA,Getting Started with Data Analysis in Snowflake using Python and SQL,2023-11-22T05:10:29Z,1064,38,0,PT1H6M2S,hd,,en,False,Live Code-Alongs,UC79Gv3mYp6zKiSwYemEik9A,DataCamp,2023-11-23T11:07:01Z,33
PLjgj6kdf_snYc7OjL3P-QnUorZHBsTqMJ,Pb_RGAl75VE,Fine-Tuning Your Own Llama 2 Model,2023-11-18T05:30:59Z,3270,119,4,PT1H22M46S,hd,,en,False,Live Code-Alongs,UC79Gv3mYp6zKiSwYemEik9A,DataCamp,2023-11-23T11:07:01Z,33
PLjgj6kdf_snYc7OjL3P-QnUorZHBsTqMJ,wgYMtExWiNI,Running Machine Learning Experiments in Python,2023-11-15T05:09:55Z,954,47,1,PT1H8M59S,hd,,en,False,Live Code-Alongs,UC79Gv3mYp6zKiSwYemEik9A,DataCamp,2023-11-23T11:07:01Z,33
PLjgj6kdf_snYc7OjL3P-QnUorZHBsTqMJ,fdhzu3sqcMc,Simplifying Image Recognition using ApertureDB and Python,2023-11-08T05:21:37Z,425,14,0,PT1H10M46S,hd,,en,False,Live Code-Alongs,UC79Gv3mYp6zKiSwYemEik9A,DataCamp,2023-11-23T11:07:01Z,33
PLjgj6kdf_snYc7OjL3P-QnUorZHBsTqMJ,O6H3TvczO8I,Using ChatGPT's Advanced Data Analysis,2023-11-02T16:58:36Z,4566,117,5,PT1H6M49S,hd,,en,False,Live Code-Alongs,UC79Gv3mYp6zKiSwYemEik9A,DataCamp,2023-11-23T11:07:01Z,33
PLjgj6kdf_snYc7OjL3P-QnUorZHBsTqMJ,fOEJ52u0JMU,ChatGPT Prompt Engineering for Beginners,2023-11-01T04:20:19Z,1000,40,1,PT1H12M14S,hd,,en,False,Live Code-Alongs,UC79Gv3mYp6zKiSwYemEik9A,DataCamp,2023-11-23T11:07:01Z,33
PLjgj6kdf_snYc7OjL3P-QnUorZHBsTqMJ,ZBvLJ4L4hqk,Visualizing Sales Data with PivotCharts in Excel,2023-10-28T04:05:12Z,592,44,0,PT1H3M10S,hd,,en,False,Live Code-Alongs,UC79Gv3mYp6zKiSwYemEik9A,DataCamp,2023-11-23T11:07:01Z,33
PLjgj6kdf_snYc7OjL3P-QnUorZHBsTqMJ,M1LkGpFI5SQ,Retrieval Augmented Generation with GPT and Milvus,2023-10-25T04:04:18Z,415,14,1,PT1H4M57S,hd,,en,False,Live Code-Alongs,UC79Gv3mYp6zKiSwYemEik9A,DataCamp,2023-11-23T11:07:01Z,33
PLjgj6kdf_snYc7OjL3P-QnUorZHBsTqMJ,l4cdXf-59x0,Using Large Language Models with the Cohere API,2023-10-04T03:59:03Z,524,17,0,PT57M51S,hd,,en,False,Live Code-Alongs,UC79Gv3mYp6zKiSwYemEik9A,DataCamp,2023-11-23T11:07:01Z,33
PLjgj6kdf_snYc7OjL3P-QnUorZHBsTqMJ,BgvT3dpwi0s,Getting Started with Data Visualization in Power BI,2023-09-23T04:09:07Z,815,34,2,PT1H4M44S,hd,,en,False,Live Code-Alongs,UC79Gv3mYp6zKiSwYemEik9A,DataCamp,2023-11-23T11:07:01Z,33
PLjgj6kdf_snYc7OjL3P-QnUorZHBsTqMJ,P0TpKUN1dPg,SQL for Absolute Beginners,2023-09-19T16:13:56Z,1971,99,3,PT1H5M8S,hd,,en,False,Live Code-Alongs,UC79Gv3mYp6zKiSwYemEik9A,DataCamp,2023-11-23T11:07:01Z,33
PLjgj6kdf_snYc7OjL3P-QnUorZHBsTqMJ,Wui0u7HzHu0,Exploratory Data Analysis in Spreadsheets,2023-09-16T05:41:49Z,1498,75,6,PT1H9M1S,hd,,en,False,Live Code-Alongs,UC79Gv3mYp6zKiSwYemEik9A,DataCamp,2023-11-23T11:07:01Z,33
PLjgj6kdf_snYc7OjL3P-QnUorZHBsTqMJ,FtRt6mKUJYE,Data Storytelling for Absolute Beginners: A Case Study with Green Businesses,2023-09-09T04:15:19Z,1000,42,0,PT1H14M41S,hd,,en,False,Live Code-Alongs,UC79Gv3mYp6zKiSwYemEik9A,DataCamp,2023-11-23T11:07:01Z,33
PLjgj6kdf_snYc7OjL3P-QnUorZHBsTqMJ,p96cKUoWshU,Using AI to Enhance Product Pages with LangChain and Python,2023-08-23T04:15:52Z,537,23,1,PT1H14M2S,hd,,en,False,Live Code-Alongs,UC79Gv3mYp6zKiSwYemEik9A,DataCamp,2023-11-23T11:07:01Z,33
PLjgj6kdf_snYc7OjL3P-QnUorZHBsTqMJ,GDYTBhwj5oI,Vector Databases for Data Science with Weaviate in Python,2023-08-16T04:16:02Z,911,40,2,PT1H11M6S,hd,,en,False,Live Code-Alongs,UC79Gv3mYp6zKiSwYemEik9A,DataCamp,2023-11-23T11:07:01Z,33
PLjgj6kdf_snYc7OjL3P-QnUorZHBsTqMJ,jGkRsmt8uvg,Using Feature Stores for Managing Feature Engineering in Python,2023-08-09T04:05:44Z,510,22,0,PT1H3M9S,hd,,en,False,Live Code-Alongs,UC79Gv3mYp6zKiSwYemEik9A,DataCamp,2023-11-23T11:07:01Z,33
PLjgj6kdf_snYc7OjL3P-QnUorZHBsTqMJ,mQxsyRbNpkM,Analyzing Top Runner Performance from A to Z with AI using Workspace,2023-08-02T04:05:01Z,490,25,0,PT1H39S,hd,,en,False,Live Code-Alongs,UC79Gv3mYp6zKiSwYemEik9A,DataCamp,2023-11-23T11:07:01Z,33
PLjgj6kdf_snYc7OjL3P-QnUorZHBsTqMJ,uGlRcnGtv50,Optimizing GPT Prompts for Data Science,2023-07-29T04:24:14Z,1373,68,2,PT1H13M37S,hd,,en,False,Live Code-Alongs,UC79Gv3mYp6zKiSwYemEik9A,DataCamp,2023-11-23T11:07:01Z,33
PLjgj6kdf_snYc7OjL3P-QnUorZHBsTqMJ,eI_XmQwlEqQ,Using ChatGPT Code Interpreter for Data Science,2023-07-21T16:12:21Z,4747,184,2,PT1H8M39S,hd,,en,False,Live Code-Alongs,UC79Gv3mYp6zKiSwYemEik9A,DataCamp,2023-11-23T11:07:01Z,33
PLjgj6kdf_snYc7OjL3P-QnUorZHBsTqMJ,hctZDeB14-s,Introduction to Experiment Tracking,2023-07-20T04:06:41Z,399,14,0,PT1H8M11S,hd,,en-US,False,Live Code-Alongs,UC79Gv3mYp6zKiSwYemEik9A,DataCamp,2023-11-23T11:07:01Z,33
PLjgj6kdf_snYc7OjL3P-QnUorZHBsTqMJ,o6OAg-TdzMQ,Data Modeling in SQL,2023-07-12T04:06:36Z,1858,68,2,PT1H5M19S,hd,,en-US,False,Live Code-Alongs,UC79Gv3mYp6zKiSwYemEik9A,DataCamp,2023-11-23T11:07:01Z,33
PLjgj6kdf_snYc7OjL3P-QnUorZHBsTqMJ,Qs-0zXeE9J4,Using Synthetic Data for Machine Learning & AI in Python,2023-07-06T04:06:06Z,1106,73,0,PT1H3M4S,hd,,en-US,False,Live Code-Alongs,UC79Gv3mYp6zKiSwYemEik9A,DataCamp,2023-11-23T11:07:01Z,33
PLjgj6kdf_snYc7OjL3P-QnUorZHBsTqMJ,UuV4W4LU6hc,Building AI Applications with LangChain and GPT,2023-06-14T04:23:02Z,2478,88,3,PT1H22M23S,hd,,en-US,False,Live Code-Alongs,UC79Gv3mYp6zKiSwYemEik9A,DataCamp,2023-11-23T11:07:01Z,33
PLjgj6kdf_snYc7OjL3P-QnUorZHBsTqMJ,9-nVkWOL-sM,Report Design Best Practices in Power BI,2023-06-10T04:15:11Z,1017,39,0,PT1H14M14S,hd,,en-US,False,Live Code-Alongs,UC79Gv3mYp6zKiSwYemEik9A,DataCamp,2023-11-23T11:07:01Z,33
PLjgj6kdf_snYc7OjL3P-QnUorZHBsTqMJ,J1HZEdhEEj8,Sloth or Pastry? Using PyTorch and Deep Learning for Image Classification,2023-05-31T04:00:08Z,637,16,0,PT1H17S,hd,,en-US,False,Live Code-Alongs,UC79Gv3mYp6zKiSwYemEik9A,DataCamp,2023-11-23T11:07:01Z,33
PLjgj6kdf_snYc7OjL3P-QnUorZHBsTqMJ,-VENXLh2Lh0,Dashboard Design Best Practices in Tableau,2023-05-27T04:08:25Z,1585,38,0,PT1H6M51S,hd,,en-US,False,Live Code-Alongs,UC79Gv3mYp6zKiSwYemEik9A,DataCamp,2023-11-23T11:07:01Z,33
PLjgj6kdf_snYc7OjL3P-QnUorZHBsTqMJ,izFV5hbOXMw,Generating Photorealistic Images using AI with Diffusers in Python,2023-05-17T04:23:09Z,1205,47,0,PT1H5M22S,hd,,en-US,False,Live Code-Alongs,UC79Gv3mYp6zKiSwYemEik9A,DataCamp,2023-11-23T11:07:01Z,33
PLjgj6kdf_snYc7OjL3P-QnUorZHBsTqMJ,kl8vbrx4XdY,Analyzing Credit Scores with tidymodels in R,2023-05-10T04:06:28Z,1483,62,2,PT59M55S,hd,,en-US,False,Live Code-Alongs,UC79Gv3mYp6zKiSwYemEik9A,DataCamp,2023-11-23T11:07:01Z,33
PLjgj6kdf_snYc7OjL3P-QnUorZHBsTqMJ,jWyxmeiJsyw,Analyzing eCommerce Data in Tableau,2023-05-06T04:06:45Z,1267,50,2,PT1H5M24S,hd,,en-US,False,Live Code-Alongs,UC79Gv3mYp6zKiSwYemEik9A,DataCamp,2023-11-23T11:07:01Z,33
PLjgj6kdf_snYc7OjL3P-QnUorZHBsTqMJ,fOZvR7Y3-l8,Analyzing Categorical Data from the General Social Survey in Python,2023-04-26T04:14:10Z,1700,58,5,PT1H10M22S,hd,,en-US,False,Live Code-Alongs,UC79Gv3mYp6zKiSwYemEik9A,DataCamp,2023-11-23T11:07:01Z,33
PLjgj6kdf_snYc7OjL3P-QnUorZHBsTqMJ,lQ_K_DHssxo,Cleaning Data in Python,2023-04-19T04:15:00Z,3046,114,6,PT1H11M29S,hd,,en-US,False,Live Code-Alongs,UC79Gv3mYp6zKiSwYemEik9A,DataCamp,2023-11-23T11:07:01Z,33
PLjgj6kdf_snYc7OjL3P-QnUorZHBsTqMJ,7JybsRgzyYI,Feature Engineering for Predicting Hotel Bookings with tidymodels,2023-04-12T04:14:56Z,1373,52,0,PT1H11M49S,hd,,en-US,False,Live Code-Alongs,UC79Gv3mYp6zKiSwYemEik9A,DataCamp,2023-11-23T11:07:01Z,33
PLjgj6kdf_snYc7OjL3P-QnUorZHBsTqMJ,MLR4pIKZHI8,A Beginner's Guide to Prompt Engineering with ChatGPT,2023-04-05T16:12:19Z,11732,279,12,PT1H10M50S,hd,,en-US,False,Live Code-Alongs,UC79Gv3mYp6zKiSwYemEik9A,DataCamp,2023-11-23T11:07:01Z,33
PLjgj6kdf_snYTQQsFPnegjQy9kGO72fZo,oO2RFvpHjDg,DataCamp 101: Getting Started with DataCamp,2023-08-30T10:07:36Z,734,11,2,PT11M48S,hd,"['getting started with datacamp', 'datacamp tutorial', 'datacamp for business', 'data science skills', 'how to use datacamp', 'datacamp 101']",en,False,DataCamp 101: Build Data & AI Skills with DataCamp,UC79Gv3mYp6zKiSwYemEik9A,DataCamp,2023-08-29T12:56:31Z,2
PLjgj6kdf_snYTQQsFPnegjQy9kGO72fZo,O8nCMV0XVdo,DataCamp 101: 5 Ways to Make the Most of DataCamp,2023-08-30T10:07:40Z,788,17,0,PT6M55S,hd,"['datacamp workspace', 'how to use datacamp', 'datacamp tips', 'datacamp certifications', 'datacamp skill verifications', 'datacamp competitions', 'leaderboards', 'popular data & ai topics']",en,False,DataCamp 101: Build Data & AI Skills with DataCamp,UC79Gv3mYp6zKiSwYemEik9A,DataCamp,2023-08-29T12:56:31Z,2
PLjgj6kdf_snakWnU-Jb8P7tvSI8EtboSe,hcyOajJfSLs,What is the OpenAI API?,2023-08-10T14:09:16Z,715,6,0,PT4M12S,hd,,en,False,Working with the OpenAI API,UC79Gv3mYp6zKiSwYemEik9A,DataCamp,2023-08-10T14:00:12Z,3
PLjgj6kdf_snakWnU-Jb8P7tvSI8EtboSe,-uanVAE4KPQ,How to Make Requests to the OpenAI API,2023-08-10T14:25:21Z,594,8,1,PT4M19S,hd,,en,False,Working with the OpenAI API,UC79Gv3mYp6zKiSwYemEik9A,DataCamp,2023-08-10T14:00:12Z,3
PLjgj6kdf_snakWnU-Jb8P7tvSI8EtboSe,0V57Rk74LLo,OpenAI API Endpoints | What You Need to Know,2023-08-10T14:35:19Z,660,13,0,PT4M18S,hd,,en,False,Working with the OpenAI API,UC79Gv3mYp6zKiSwYemEik9A,DataCamp,2023-08-10T14:00:12Z,3
PLjgj6kdf_snahk0bX7s_8tIQuLWxmzPkv,UwEs5b0ZGW8,What is ChatGPT? ChatGPT Explained in 5 Minutes by the Experts,2023-06-27T15:56:02Z,738,11,1,PT4M52S,hd,,en-US,False,Introduction to ChatGPT,UC79Gv3mYp6zKiSwYemEik9A,DataCamp,2023-06-27T10:51:00Z,6
PLjgj6kdf_snahk0bX7s_8tIQuLWxmzPkv,AqQcnc2GxnM,What are the Limitations of ChatGPT? | Understanding Generative AI's Challenges,2023-06-27T15:56:06Z,422,7,0,PT4M17S,hd,,en-US,False,Introduction to ChatGPT,UC79Gv3mYp6zKiSwYemEik9A,DataCamp,2023-06-27T10:51:00Z,6
PLjgj6kdf_snahk0bX7s_8tIQuLWxmzPkv,bAfiiMwXP_0,How to Write Effective ChatGPT Prompts (ChatGPT Advice from the Experts),2023-06-27T15:56:09Z,904,13,3,PT3M54S,hd,,en-US,False,Introduction to ChatGPT,UC79Gv3mYp6zKiSwYemEik9A,DataCamp,2023-06-27T10:51:00Z,6
PLjgj6kdf_snahk0bX7s_8tIQuLWxmzPkv,xCDpWdBJZlw,How Businesses Can Use ChatGPT | ChatGPT Use Cases,2023-07-07T13:33:31Z,445,5,1,PT4M40S,hd,,en-US,False,Introduction to ChatGPT,UC79Gv3mYp6zKiSwYemEik9A,DataCamp,2023-06-27T10:51:00Z,6
PLjgj6kdf_snahk0bX7s_8tIQuLWxmzPkv,7T3KQt_cj54,When Should You Use ChatGPT and When Shouldn't You? 🤔 Use this Framework!,2023-07-07T14:05:33Z,353,6,0,PT4M17S,hd,,en-US,False,Introduction to ChatGPT,UC79Gv3mYp6zKiSwYemEik9A,DataCamp,2023-06-27T10:51:00Z,6
PLjgj6kdf_snahk0bX7s_8tIQuLWxmzPkv,Kxz356Gd0w8,What Will Shape the Future of Generative AI? 🤔,2023-07-07T14:20:51Z,316,5,1,PT4M17S,hd,,en-US,False,Introduction to ChatGPT,UC79Gv3mYp6zKiSwYemEik9A,DataCamp,2023-06-27T10:51:00Z,6
PLjgj6kdf_snbsSNtOVVJzCgDm4WRlz-gd,Nykl1zu_asw,How to onboard learners and accelerate adoption with DataCamp Enterprise,2023-06-21T11:05:15Z,231,3,0,PT4M56S,hd,"['datacamp', 'datacamp admin guide', 'datacamp admin tutorial', 'how to add learners on datacamp', 'hot to invite members on datacamp', 'datacamp for business', 'creating teams on datacamp', 'enable sso on datacamp', 'role permissions datacamp', 'admin guide datacamp', 'datacamp admin interface']",en-US,False,Admin University Series: DataCamp Enterprise & Unlimited,UC79Gv3mYp6zKiSwYemEik9A,DataCamp,2023-06-21T10:07:03Z,4
PLjgj6kdf_snbsSNtOVVJzCgDm4WRlz-gd,5P9n7jeG-yc,How to increase learner engagement with DataCamp Enterprise,2023-06-21T11:05:19Z,105,1,0,PT4M53S,hd,"['datacamp', 'datacamp admin guide', 'datacamp admin tutorial', 'datacamp for business', 'admin guide datacamp', 'datacamp admin interface', 'admin university series', 'datacamp custom tracks', 'datacamp assignments', 'hot to create a custom track', 'organization tracks', 'how to create an assignment', 'datacamp tracks']",en-US,False,Admin University Series: DataCamp Enterprise & Unlimited,UC79Gv3mYp6zKiSwYemEik9A,DataCamp,2023-06-21T10:07:03Z,4
PLjgj6kdf_snbsSNtOVVJzCgDm4WRlz-gd,lFm0FpU6EzM,How to track learning program success with DataCamp Enterprise,2023-06-21T11:05:23Z,119,0,0,PT6M15S,hd,"['datacamp', 'datacamp admin guide', 'datacamp admin tutorial', 'datacamp for business', 'admin guide datacamp', 'datacamp admin interface', 'datacamp reporting', 'datacamp dashboards', 'datacamp lms integration', 'datacamp data export', 'datacamp roi']",en-US,False,Admin University Series: DataCamp Enterprise & Unlimited,UC79Gv3mYp6zKiSwYemEik9A,DataCamp,2023-06-21T10:07:03Z,4
PLjgj6kdf_snbsSNtOVVJzCgDm4WRlz-gd,zwG93L96dCE,How to encourage a vibrant data culture with DataCamp Enterprise,2023-06-21T11:05:26Z,173,3,0,PT3M51S,hd,"['datacamp', 'datacamp admin guide', 'datacamp admin tutorial', 'datacamp for business', 'admin guide datacamp', 'datacamp admin interface', 'data culture', 'datacamp competitions', 'datacamp hackathons', 'data hackathons', 'data community']",en-US,False,Admin University Series: DataCamp Enterprise & Unlimited,UC79Gv3mYp6zKiSwYemEik9A,DataCamp,2023-06-21T10:07:03Z,4
PLjgj6kdf_sna2NRETQii7piHuDUs5clr9,bLt9BEocsqM,What's New In DataCamp – May 2023,2023-05-12T13:21:42Z,1496,53,1,PT5M12S,hd,"['datacamp', 'datacamp for business', 'datacamp updates', 'learn chatgpt', 'chatgpt', 'introduction to chatgpt', 'learn mlops', 'mlops courses', 'data engineer certification', 'become data engineer', 'learn data engineering', 'datacamp workspace', 'datacamp certifications', ""what's new in datacamp""]",en-US,False,New in DataCamp,UC79Gv3mYp6zKiSwYemEik9A,DataCamp,2023-05-12T10:11:23Z,3
PLjgj6kdf_sna2NRETQii7piHuDUs5clr9,qvLDfBlnLKg,What's New in DataCamp – July 2023,2023-07-07T08:52:14Z,372,22,1,PT10M34S,hd,"['lern ai', 'new in datacamp', 'data skills', 'data science courses', 'datacamp', 'datacamp for business']",en-US,False,New in DataCamp,UC79Gv3mYp6zKiSwYemEik9A,DataCamp,2023-05-12T10:11:23Z,3
PLjgj6kdf_sna2NRETQii7piHuDUs5clr9,OWj6nmi1UUw,What's New in DataCamp – August 2023,2023-08-23T08:58:41Z,502,17,1,PT7M26S,hd,"['lern ai', 'new in datacamp', 'data skills', 'data science courses', 'datacamp', 'datacamp for business', 'data literacy', 'ai literacy']",en,False,New in DataCamp,UC79Gv3mYp6zKiSwYemEik9A,DataCamp,2023-05-12T10:11:23Z,3
PLjgj6kdf_snaPNIGFvHoNY8ctfpgpdE9G,MuZYn3wJMsI,Reset Course Progress in DataCamp,2023-02-17T14:59:51Z,1307,14,1,PT43S,hd,,en-US,False,DataCamp Help Center,UC79Gv3mYp6zKiSwYemEik9A,DataCamp,2023-02-17T14:54:46Z,1
PLjgj6kdf_snax3iLcYKjJIdyr-Yznq-cA,kClXkoXH2AA,Sentiment analysis and prediction in Python | Live Code-Along,2022-07-27T17:00:14Z,2802,78,2,PT48M49S,hd,"['Python', 'sentiment analysis', 'sentiment analysis python', 'code along', 'sentiment analysis tutorial', 'python code along', 'live code tutorial']",en-US,False,Live Code-Along,UC79Gv3mYp6zKiSwYemEik9A,DataCamp,2022-07-27T14:47:52Z,2
PLjgj6kdf_snax3iLcYKjJIdyr-Yznq-cA,cvcxLZ1P0ds,Visualizing Cost Savings in Tableau | Live Code-Along,2022-08-11T17:00:12Z,840,19,1,PT1H3M8S,hd,"['Tableau', 'tableau visualizations', 'cost saving tableau', 'tableau cost visualizations']",en-US,False,Live Code-Along,UC79Gv3mYp6zKiSwYemEik9A,DataCamp,2022-07-27T14:47:52Z,2
PLjgj6kdf_snYlCntNF_Ms0OZXIHiAi_ee,jA0-O5wX_VQ,For and While Loops in Python | Databytes | Python Basics Tutorial,2022-05-20T11:02:41Z,1203,23,0,PT7M18S,hd,"['Data Science', 'Python', 'Python basics', 'python for beginners', 'python tutorial', 'data science tutorial']",en-US,False,DataBytes,UC79Gv3mYp6zKiSwYemEik9A,DataCamp,2022-05-20T10:58:10Z,8
PLjgj6kdf_snYlCntNF_Ms0OZXIHiAi_ee,aqzxYofJ_ck,Python Machine Learning Tutorial | Splitting Your Data | Databytes,2022-05-31T14:07:58Z,1080,25,2,PT12M33S,hd,"['Machine learning', 'machine learning in python', 'splitting data', 'ml splitting data', 'training and test data']",en-US,False,DataBytes,UC79Gv3mYp6zKiSwYemEik9A,DataCamp,2022-05-20T10:58:10Z,8
PLjgj6kdf_snYlCntNF_Ms0OZXIHiAi_ee,eNKVHtITzeE,Dictionaries in Python | Databytes | Python Basics Tutorial,2022-05-30T10:43:04Z,513,14,0,PT7M23S,hd,"['Python basics', 'python for beginners', 'python tutorial', 'data science tutorial', 'dictionaries in python', 'coding dictionaries']",en-US,False,DataBytes,UC79Gv3mYp6zKiSwYemEik9A,DataCamp,2022-05-20T10:58:10Z,8
PLjgj6kdf_snYlCntNF_Ms0OZXIHiAi_ee,jA0-O5wX_VQ,For and While Loops in Python | Databytes | Python Basics Tutorial,2022-05-20T11:02:41Z,1203,23,0,PT7M18S,hd,"['Data Science', 'Python', 'Python basics', 'python for beginners', 'python tutorial', 'data science tutorial']",en-US,False,DataBytes,UC79Gv3mYp6zKiSwYemEik9A,DataCamp,2022-05-20T10:58:10Z,8
PLjgj6kdf_snYlCntNF_Ms0OZXIHiAi_ee,fYnUQJ2d67Q,Python Machine Learning Tutorial | Handling Missing Data | Databytes,2022-05-19T18:00:41Z,637,30,1,PT23M11S,hd,"['Data Science', 'Python', 'Python basics', 'coding', 'missing data', 'ML missing data', 'machine learning', 'python tutorial', 'tutorial', 'coding tutorial']",en-US,False,DataBytes,UC79Gv3mYp6zKiSwYemEik9A,DataCamp,2022-05-20T10:58:10Z,8
PLjgj6kdf_snYlCntNF_Ms0OZXIHiAi_ee,wIypzZvtkNI,"Working with Python Operators, Data Types & Variables | Databytes | Python Basic Tutorial",2022-05-11T17:06:07Z,484,16,1,PT6M15S,hd,"['python operators', 'python data types', 'python variables']",en-US,False,DataBytes,UC79Gv3mYp6zKiSwYemEik9A,DataCamp,2022-05-20T10:58:10Z,8
PLjgj6kdf_snYlCntNF_Ms0OZXIHiAi_ee,lfqjQeKwNmI,Python Machine Learning Tutorial | Centering And Scaling | Databytes,2022-05-09T18:35:27Z,969,27,2,PT14M5S,hd,"['Data Science', 'Python', 'Python basics', 'coding', 'scaling', 'centering', 'machine learning', 'python tutorial', 'tutorial', 'coding tutorial']",en-US,False,DataBytes,UC79Gv3mYp6zKiSwYemEik9A,DataCamp,2022-05-20T10:58:10Z,8
PLjgj6kdf_snYlCntNF_Ms0OZXIHiAi_ee,5q00rcjA1kM,How To Do A Classification Tree in Python | Machine Learning in Python | Databytes,2022-07-08T15:23:08Z,614,12,2,PT18M7S,hd,"['Classification tree', 'supervised learning python', 'classification tree in python', 'supervised learning classification tree']",en-US,False,DataBytes,UC79Gv3mYp6zKiSwYemEik9A,DataCamp,2022-05-20T10:58:10Z,8
PLjgj6kdf_snZALVgjTiZQniaoUOzKDS0b,kM4DXNMPIWQ,The Tech Powering The 2022 FIFA World Cup | The Weekly Roundup,2022-12-15T00:44:22Z,858,21,0,PT5M58S,hd,"['Meta', 'CICERO', 'negotiation ai', 'ai news', 'trapview', 'world cup', 'fifa', 'world cup 2022', 'world cup ai']",en-US,False,Weekly Roundup,UC79Gv3mYp6zKiSwYemEik9A,DataCamp,2022-05-18T10:28:49Z,29
