playlist_id,video_id,title,published,view_count,like_count,comment_count,duration,definition,tags,default_audio_language,madeforkid,playlist_title,channel_id,channelTitle,playlist_published,playlist_numvideo
PLQVvvaa0QuDfK-Zv2FS29XfQ1CHJbcPpP,CIQ20FWs478,Home Lab Build - P.1 - Building a NAS,2022-06-15T13:27:20Z,88907,2467,123,PT17M7S,hd,"['python', 'programming']",en,False,Home Lab,UCfzlCWGWYyIQ0aLC5w48gBQ,sentdex,2022-07-01T14:39:41Z,2
PLQVvvaa0QuDfK-Zv2FS29XfQ1CHJbcPpP,BVWmstt0AWM,Home Lab Build - P.2 - Rack has evolved!,2022-07-01T14:40:12Z,209020,4993,182,PT11M21S,hd,"['python', 'programming']",en,False,Home Lab,UCfzlCWGWYyIQ0aLC5w48gBQ,sentdex,2022-07-01T14:39:41Z,2
PLQVvvaa0QuDcBby2qVDsDv41GghEQfr5E,HlLK5BA0wT0,Starcraft 2 AI with Python - Introduction (p.1),2022-03-05T16:55:01Z,56954,1534,69,PT13M57S,hd,"['python', 'programming']",en,False,Starcraft 2 AI,UCfzlCWGWYyIQ0aLC5w48gBQ,sentdex,2022-03-05T16:52:28Z,4
PLQVvvaa0QuDcBby2qVDsDv41GghEQfr5E,fqEzFZ2z6S4,Starcraft 2 AI with Python - Building Defenses (p.2),2022-03-06T16:05:21Z,32069,739,49,PT28M54S,hd,"['python', 'programming']",en,False,Starcraft 2 AI,UCfzlCWGWYyIQ0aLC5w48gBQ,sentdex,2022-03-05T16:52:28Z,4
PLQVvvaa0QuDcBby2qVDsDv41GghEQfr5E,FyhxoHKFIiY,Attacking and Defeating the Enemy - Starcraft 2 AI with Python (p.3),2022-03-07T15:21:37Z,22278,464,52,PT35M8S,hd,"['python', 'programming']",en,False,Starcraft 2 AI,UCfzlCWGWYyIQ0aLC5w48gBQ,sentdex,2022-03-05T16:52:28Z,4
PLQVvvaa0QuDcBby2qVDsDv41GghEQfr5E,q59wap1ELQ4,A. I. Learns to Play Starcraft 2 (Reinforcement Learning),2022-04-23T15:05:05Z,408021,10331,306,PT17M42S,hd,"['python', 'programming', 'starcraft 2', 'AI', 'reinforcement learning', 'artificial intelligence']",en,False,Starcraft 2 AI,UCfzlCWGWYyIQ0aLC5w48gBQ,sentdex,2022-03-05T16:52:28Z,4
PLQVvvaa0QuDf0O2DWwLZBfJeYY-JOeZB1,XbWhJdQgi7E,Reinforcement Learning with Stable Baselines 3 - Introduction (P.1),2022-02-05T15:56:01Z,72371,1557,85,PT23M12S,hd,"['python', 'programming']",en,False,Reinforcement Learning with Stable Baselines 3,UCfzlCWGWYyIQ0aLC5w48gBQ,sentdex,2022-02-05T15:37:22Z,4
PLQVvvaa0QuDf0O2DWwLZBfJeYY-JOeZB1,dLP-2Y6yu70,Saving and Loading Models - Stable Baselines 3 Tutorial (P.2),2022-02-06T15:48:54Z,33669,661,50,PT33M7S,hd,"['python', 'programming']",en,False,Reinforcement Learning with Stable Baselines 3,UCfzlCWGWYyIQ0aLC5w48gBQ,sentdex,2022-02-05T15:37:22Z,4
PLQVvvaa0QuDf0O2DWwLZBfJeYY-JOeZB1,uKnjGn8fF70,Custom Environments - Reinforcement Learning with Stable Baselines 3 (P.3),2022-02-07T15:00:05Z,42354,771,71,PT37M28S,hd,"['python', 'programming']",en,False,Reinforcement Learning with Stable Baselines 3,UCfzlCWGWYyIQ0aLC5w48gBQ,sentdex,2022-02-05T15:37:22Z,4
PLQVvvaa0QuDf0O2DWwLZBfJeYY-JOeZB1,yvwxbkKX9dc,Tweaking Custom Environment Rewards - Reinforcement Learning with Stable Baselines 3 (P.4),2022-02-08T15:18:17Z,21687,460,38,PT11M59S,hd,"['python', 'programming']",en,False,Reinforcement Learning with Stable Baselines 3,UCfzlCWGWYyIQ0aLC5w48gBQ,sentdex,2022-02-05T15:37:22Z,4
PLQVvvaa0QuDenVbxP4LXYZoGbjfgP-Y5i,phTnbmXM06g,Can we simulate a real robot?,2021-10-13T15:22:16Z,94753,2920,117,PT21M26S,hd,"['python', 'programming']",en,False,Physics Simulator w/ Robot Dog,UCfzlCWGWYyIQ0aLC5w48gBQ,sentdex,2021-11-28T16:51:04Z,3
PLQVvvaa0QuDenVbxP4LXYZoGbjfgP-Y5i,6qbW7Ki9NUc,Teaching Robots to Walk w/ Reinforcement Learning,2021-11-28T16:47:58Z,59618,1609,100,PT22M3S,hd,"['python', 'programming']",en,False,Physics Simulator w/ Robot Dog,UCfzlCWGWYyIQ0aLC5w48gBQ,sentdex,2021-11-28T16:51:04Z,3
PLQVvvaa0QuDenVbxP4LXYZoGbjfgP-Y5i,A0tPe7-R8z0,Robot Dog Learns to Walk - Bittle Reinforcement Learning p.3,2022-01-01T16:40:04Z,52161,1125,100,PT22M6S,hd,"['python', 'programming']",en,False,Physics Simulator w/ Robot Dog,UCfzlCWGWYyIQ0aLC5w48gBQ,sentdex,2021-11-28T16:51:04Z,3
PLQVvvaa0QuDdKvPge9PXQtFzvhMRyFPhW,3P3TcKaegbA,Generative Python Transformer p.1 - Acquiring Raw Data,2021-05-03T14:13:02Z,60034,1308,121,PT36M10S,hd,"['python', 'programming']",en,False,Generating Python code with GPT,UCfzlCWGWYyIQ0aLC5w48gBQ,sentdex,2021-05-07T15:06:50Z,7
PLQVvvaa0QuDdKvPge9PXQtFzvhMRyFPhW,MPK3HEKvhes,Generative Python Transformer p.2 - Raw Data Cleaning,2021-05-07T15:11:00Z,17844,518,61,PT24M41S,hd,"['python', 'programming']",en,False,Generating Python code with GPT,UCfzlCWGWYyIQ0aLC5w48gBQ,sentdex,2021-05-07T15:06:50Z,7
PLQVvvaa0QuDdKvPge9PXQtFzvhMRyFPhW,PUr-4ouD0Xc,Generative Python Transformer p.3 - Preprocessing Dataset,2021-05-10T14:40:27Z,16049,432,63,PT33M,hd,"['python', 'programming']",en,False,Generating Python code with GPT,UCfzlCWGWYyIQ0aLC5w48gBQ,sentdex,2021-05-07T15:06:50Z,7
PLQVvvaa0QuDdKvPge9PXQtFzvhMRyFPhW,4WHt1VLon_U,Generative Python Transformer p.4 - Tokenizing,2021-05-15T17:18:24Z,15656,466,40,PT24M23S,hd,"['python', 'programming']",en,False,Generating Python code with GPT,UCfzlCWGWYyIQ0aLC5w48gBQ,sentdex,2021-05-07T15:06:50Z,7
PLQVvvaa0QuDdKvPge9PXQtFzvhMRyFPhW,2486auSLTUI,Generative Python Transformer p.5 - Training and some testing of GPT-2 model,2021-05-22T15:07:00Z,23770,594,46,PT41M5S,hd,"['python', 'programming']",en,False,Generating Python code with GPT,UCfzlCWGWYyIQ0aLC5w48gBQ,sentdex,2021-05-07T15:06:50Z,7
PLQVvvaa0QuDdKvPge9PXQtFzvhMRyFPhW,vG-z-Y_Sfrw,Generative Python Transformer p.6 - Testing larger model,2021-05-29T14:12:05Z,17072,397,58,PT48M49S,hd,"['python', 'programming']",en,False,Generating Python code with GPT,UCfzlCWGWYyIQ0aLC5w48gBQ,sentdex,2021-05-07T15:06:50Z,7
PLQVvvaa0QuDdKvPge9PXQtFzvhMRyFPhW,1PMECYArtuk,GPyT - Generative Python Transformer Model released (the off-brand Github Copilot),2021-07-23T16:44:07Z,25281,620,55,PT28M33S,hd,"['python', 'programming']",en,False,Generating Python code with GPT,UCfzlCWGWYyIQ0aLC5w48gBQ,sentdex,2021-05-07T15:06:50Z,7
PLQVvvaa0QuDc6XkxPPWF0APTmiofFV-lE,CumHy6v7un0,"P.1 Chatbot with Mic input/Speaker output using Python, Jarvis, and DialoGPT",2021-04-26T13:49:54Z,47314,1506,120,PT35M52S,hd,,en,False,"Chatbot with Mic input/Speaker output using Python, Jarvis, and DialoGPT",UCfzlCWGWYyIQ0aLC5w48gBQ,sentdex,2021-04-30T14:13:40Z,2
PLQVvvaa0QuDc6XkxPPWF0APTmiofFV-lE,lheXIYXanuU,"P.2 Chatbot with Mic input/Speaker output using Python, Jarvis, and DialoGPT",2021-04-30T14:15:18Z,20017,752,67,PT19M52S,hd,,en,False,"Chatbot with Mic input/Speaker output using Python, Jarvis, and DialoGPT",UCfzlCWGWYyIQ0aLC5w48gBQ,sentdex,2021-04-30T14:13:40Z,2
PLQVvvaa0QuDdcI_Z6S1nbWyOfqY48SKnM,dUU6ZsJlZKQ,Cyber Python 2077 - Using computer vision to read and walk from Cyberpunk 2077 map,2021-01-15T14:48:05Z,124047,5004,382,PT33M51S,hd,"['python', 'programming', 'tutorial', 'computer vision']",en,False,CyberPython 2077,UCfzlCWGWYyIQ0aLC5w48gBQ,sentdex,2021-01-30T15:31:05Z,2
PLQVvvaa0QuDdcI_Z6S1nbWyOfqY48SKnM,YFlYNOaIqyg,Cyber Python 2077 Part 2 - Getting to our objective,2021-01-30T15:32:08Z,52076,1550,239,PT32M28S,hd,,en,False,CyberPython 2077,UCfzlCWGWYyIQ0aLC5w48gBQ,sentdex,2021-01-30T15:31:05Z,2
PLQVvvaa0QuDcjD5BAw2DxE6OF2tius3V3,Wo5dMEP_BbI,Neural Networks from Scratch - P.1 Intro and Neuron Code,2020-04-11T13:49:09Z,1263629,31737,1614,PT16M59S,hd,"['neural networks', 'deep learning', 'python', 'nnfs', 'machine learning']",en,False,Neural Networks from Scratch in Python,UCfzlCWGWYyIQ0aLC5w48gBQ,sentdex,2020-04-11T13:48:03Z,9
PLQVvvaa0QuDcjD5BAw2DxE6OF2tius3V3,lGLto9Xd7bU,Neural Networks from Scratch - P.2 Coding a Layer,2020-04-17T13:57:47Z,371189,11182,752,PT15M6S,hd,"['neural networks', 'deep learning', 'python', 'nnfs', 'machine learning']",en,False,Neural Networks from Scratch in Python,UCfzlCWGWYyIQ0aLC5w48gBQ,sentdex,2020-04-11T13:48:03Z,9
PLQVvvaa0QuDcjD5BAw2DxE6OF2tius3V3,tMrbN67U9d4,Neural Networks from Scratch - P.3 The Dot Product,2020-04-24T14:27:00Z,300965,9915,892,PT25M17S,hd,"['dot product', 'neural networks', 'deep learning', 'python', 'nnfs', 'machine learning']",en,False,Neural Networks from Scratch in Python,UCfzlCWGWYyIQ0aLC5w48gBQ,sentdex,2020-04-11T13:48:03Z,9
PLQVvvaa0QuDcjD5BAw2DxE6OF2tius3V3,TEWy9vZcxW4,"Neural Networks from Scratch - P.4 Batches, Layers, and Objects",2020-05-01T14:07:12Z,284470,8589,933,PT33M47S,hd,"['neural networks', 'deep learning', 'tutorial', 'machine learning', 'python', 'nnfs']",en,False,Neural Networks from Scratch in Python,UCfzlCWGWYyIQ0aLC5w48gBQ,sentdex,2020-04-11T13:48:03Z,9
PLQVvvaa0QuDcjD5BAw2DxE6OF2tius3V3,gmjzbpSVY1A,Neural Networks from Scratch - P.5 Hidden Layer Activation Functions,2020-05-14T13:52:15Z,263526,7768,951,PT40M6S,hd,"['neural networks', 'deep learning', 'tutorial', 'machine learning', 'python', 'nnfs']",en,False,Neural Networks from Scratch in Python,UCfzlCWGWYyIQ0aLC5w48gBQ,sentdex,2020-04-11T13:48:03Z,9
PLQVvvaa0QuDcjD5BAw2DxE6OF2tius3V3,omz_NdFgWyU,Neural Networks from Scratch - P.6 Softmax Activation,2020-12-18T14:48:42Z,145037,4107,433,PT34M1S,hd,,en,False,Neural Networks from Scratch in Python,UCfzlCWGWYyIQ0aLC5w48gBQ,sentdex,2020-04-11T13:48:03Z,9
PLQVvvaa0QuDcjD5BAw2DxE6OF2tius3V3,dEXPMQXoiLc,Neural Networks from Scratch - P.7 Calculating Loss with Categorical Cross-Entropy,2021-01-23T15:47:17Z,116459,3064,307,PT16M19S,hd,,en,False,Neural Networks from Scratch in Python,UCfzlCWGWYyIQ0aLC5w48gBQ,sentdex,2020-04-11T13:48:03Z,9
PLQVvvaa0QuDcjD5BAw2DxE6OF2tius3V3,levekYbxauw,Neural Networks from Scratch - P.8 Implementing Loss,2021-06-05T14:27:57Z,88106,2045,193,PT17M57S,hd,"['python', 'programming', 'nnfs', 'neural networks']",en,False,Neural Networks from Scratch in Python,UCfzlCWGWYyIQ0aLC5w48gBQ,sentdex,2020-04-11T13:48:03Z,9
PLQVvvaa0QuDcjD5BAw2DxE6OF2tius3V3,txh3TQDwP1g,Neural Networks from Scratch - P.9 Introducing Optimization and derivatives,2021-08-02T22:08:08Z,101545,2404,345,PT14M13S,hd,"['python', 'programming']",en,False,Neural Networks from Scratch in Python,UCfzlCWGWYyIQ0aLC5w48gBQ,sentdex,2020-04-11T13:48:03Z,9
PLQVvvaa0QuDcDqgpLLJJM15NpIGNfrKY5,535acCxjHCI,Facial Recognition with Python and the face_recognition library,2020-03-08T18:09:04Z,219723,4729,487,PT31M5S,hd,,en,False,Facial Recognition with Python,UCfzlCWGWYyIQ0aLC5w48gBQ,sentdex,2020-03-16T18:29:37Z,2
PLQVvvaa0QuDcDqgpLLJJM15NpIGNfrKY5,PdkPI92KSIs,Facial Recognition on Video with Python,2020-03-16T14:11:37Z,109810,2227,217,PT25M1S,hd,"['python', 'tutorial', 'facial recognition']",en,False,Facial Recognition with Python,UCfzlCWGWYyIQ0aLC5w48gBQ,sentdex,2020-03-16T18:29:37Z,2
PLQVvvaa0QuDc79w6NcGB0pnoJBgaKdfrW,aPCZcv-5qfA,Quantum Computer Programming w/ Qiskit,2019-11-30T14:40:42Z,210542,6127,694,PT48M6S,hd,"['quantum', 'programming', 'qiskit', 'python', 'tutorial']",en,False,Quantum Computer Programming w/ Qiskit,UCfzlCWGWYyIQ0aLC5w48gBQ,sentdex,2019-11-30T14:41:00Z,3
PLQVvvaa0QuDc79w6NcGB0pnoJBgaKdfrW,lB_5pC1MkGg,Qubits and Gates - Quantum Computer Programming w/ Qiskit p.2,2019-12-06T14:34:50Z,37234,917,153,PT45M46S,hd,"['qiskit', 'quantum', 'programming', 'tutorial']",en,False,Quantum Computer Programming w/ Qiskit,UCfzlCWGWYyIQ0aLC5w48gBQ,sentdex,2019-11-30T14:41:00Z,3
PLQVvvaa0QuDc79w6NcGB0pnoJBgaKdfrW,_BHvE_pwF6E,Deutsch Jozsa Algorithm - Quantum Computer Programming w/ Qiskit p.3,2019-12-14T14:54:31Z,33182,718,107,PT49M58S,hd,,en,False,Quantum Computer Programming w/ Qiskit,UCfzlCWGWYyIQ0aLC5w48gBQ,sentdex,2019-11-30T14:41:00Z,3
PLQVvvaa0QuDeU-QCAwZl2UmSpfb4sWbxY,Dgo7F-lpyYE,Brain Computer Interface w/ Python and OpenBCI for EEG data,2019-10-28T13:54:52Z,175212,5657,415,PT22M53S,hd,"['brain', 'computer', 'interface', 'eeg', 'bci', 'openbci', 'python', 'tutorial']",en,False,Brain Computer Interface w/ Python and OpenBCI,UCfzlCWGWYyIQ0aLC5w48gBQ,sentdex,2019-11-09T14:13:29Z,3
PLQVvvaa0QuDeU-QCAwZl2UmSpfb4sWbxY,xStvKju-4-o,"Explorations and Testing Ideas - Brain Computer Interface w/ Python, OpenBCI, and EEG data p.2",2019-11-09T14:17:39Z,47893,1321,150,PT22M21S,hd,"['BCI', 'brain computer interface', 'openbci', 'eeg', 'python']",en,False,Brain Computer Interface w/ Python and OpenBCI,UCfzlCWGWYyIQ0aLC5w48gBQ,sentdex,2019-11-09T14:13:29Z,3
PLQVvvaa0QuDeU-QCAwZl2UmSpfb4sWbxY,Vs5xcZ4HUcY,"Getting Somewhere! - Brain Computer Interface w/ Python, OpenBCI, and EEG data p.3",2019-11-15T14:29:25Z,45790,992,121,PT35M59S,hd,"['python', 'brain computer interface', 'bci']",en,False,Brain Computer Interface w/ Python and OpenBCI,UCfzlCWGWYyIQ0aLC5w48gBQ,sentdex,2019-11-09T14:13:29Z,3
PLQVvvaa0QuDdeMyHEYc0gxFpYwHY2Qfdh,BzcBsTou0C0,Introduction - Deep Learning and Neural Networks with Python and Pytorch p.1,2019-09-23T13:57:15Z,428857,7736,348,PT24M49S,hd,"['pytorch', 'python', 'tutorial', 'deep learning', 'neural network']",en,False,Pytorch - Deep learning w/ Python,UCfzlCWGWYyIQ0aLC5w48gBQ,sentdex,2019-09-23T13:49:55Z,8
PLQVvvaa0QuDdeMyHEYc0gxFpYwHY2Qfdh,i2yPxY2rOzs,Data - Deep Learning and Neural Networks with Python and Pytorch p.2,2019-09-24T14:16:05Z,185610,3848,255,PT28M17S,hd,"['pytorch', 'python', 'tutorial', 'deep learning', 'neural network']",en,False,Pytorch - Deep learning w/ Python,UCfzlCWGWYyIQ0aLC5w48gBQ,sentdex,2019-09-23T13:49:55Z,8
PLQVvvaa0QuDdeMyHEYc0gxFpYwHY2Qfdh,ixathu7U-LQ,Building our Neural Network - Deep Learning and Neural Networks with Python and Pytorch p.3,2019-09-25T14:19:43Z,138099,2972,191,PT25M32S,hd,"['pytorch', 'python', 'tutorial', 'deep learning', 'neural network']",en,False,Pytorch - Deep learning w/ Python,UCfzlCWGWYyIQ0aLC5w48gBQ,sentdex,2019-09-23T13:49:55Z,8
PLQVvvaa0QuDdeMyHEYc0gxFpYwHY2Qfdh,9j-_dOze4IM,Training Model - Deep Learning and Neural Networks with Python and Pytorch p.4,2019-09-27T16:02:09Z,125249,2498,209,PT30M56S,hd,"['pytorch', 'python', 'tutorial', 'deep learning', 'neural network']",en,False,Pytorch - Deep learning w/ Python,UCfzlCWGWYyIQ0aLC5w48gBQ,sentdex,2019-09-23T13:49:55Z,8
PLQVvvaa0QuDdeMyHEYc0gxFpYwHY2Qfdh,9aYuQmMJvjA,Convnet Intro - Deep Learning and Neural Networks with Python and Pytorch p.5,2019-10-02T13:49:48Z,95956,1790,180,PT35M38S,hd,"['pytorch', 'python', 'tutorial', 'deep learning', 'neural network']",en,False,Pytorch - Deep learning w/ Python,UCfzlCWGWYyIQ0aLC5w48gBQ,sentdex,2019-09-23T13:49:55Z,8
PLQVvvaa0QuDdeMyHEYc0gxFpYwHY2Qfdh,1gQR24B3ISE,Training Convnet - Deep Learning and Neural Networks with Python and Pytorch p.6,2019-10-07T13:30:48Z,81856,1398,219,PT41M56S,hd,"['pytorch', 'python', 'tutorial', 'deep learning', 'neural network']",en,False,Pytorch - Deep learning w/ Python,UCfzlCWGWYyIQ0aLC5w48gBQ,sentdex,2019-09-23T13:49:55Z,8
PLQVvvaa0QuDdeMyHEYc0gxFpYwHY2Qfdh,6gk7giKER6s,On the GPU - Deep Learning and Neural Networks with Python and Pytorch p.7,2019-10-11T14:18:35Z,65996,1061,86,PT32M2S,hd,"['pytorch', 'python', 'tutorial', 'deep learning', 'neural network']",en,False,Pytorch - Deep learning w/ Python,UCfzlCWGWYyIQ0aLC5w48gBQ,sentdex,2019-09-23T13:49:55Z,8
PLQVvvaa0QuDdeMyHEYc0gxFpYwHY2Qfdh,UuteCccDXCE,Model Analysis - Deep Learning and Neural Networks with Python and Pytorch p.8,2019-10-15T14:30:21Z,49614,1009,113,PT45M41S,hd,"['pytorch', 'python', 'tutorial']",en,False,Pytorch - Deep learning w/ Python,UCfzlCWGWYyIQ0aLC5w48gBQ,sentdex,2019-09-23T13:49:55Z,8
PLQVvvaa0QuDeI12McNQdnTlWz9XlCa0uo,J1F32aVSYaU,Programming Autonomous self-driving cars with Carla and Python,2019-08-09T12:44:37Z,248928,3741,253,PT29M4S,hd,"['self-driving car', 'autonomous', 'vehicle', 'tutorial', 'python 3', 'carla']",en,False,Self-driving cars with Carla and Python,UCfzlCWGWYyIQ0aLC5w48gBQ,sentdex,2019-08-09T12:43:46Z,6
PLQVvvaa0QuDeI12McNQdnTlWz9XlCa0uo,2hM44nr7Wms,Controlling the Car and getting Camera Sensor Data - Self-driving cars with Carla and Python p.2,2019-08-12T14:40:01Z,91830,1686,145,PT34M54S,hd,"['self-driving car', 'autonomous', 'vehicle', 'tutorial', 'python 3', 'carla']",en,False,Self-driving cars with Carla and Python,UCfzlCWGWYyIQ0aLC5w48gBQ,sentdex,2019-08-09T12:43:46Z,6
PLQVvvaa0QuDeI12McNQdnTlWz9XlCa0uo,PRsp5p1l7DI,Reinforcement Learning Environment for Car Agent - Self-driving cars with Carla and Python p.3,2019-08-16T14:23:25Z,50849,768,51,PT33M39S,hd,"['self-driving car', 'autonomous', 'vehicle', 'tutorial', 'python 3', 'carla']",en,False,Self-driving cars with Carla and Python,UCfzlCWGWYyIQ0aLC5w48gBQ,sentdex,2019-08-09T12:43:46Z,6
PLQVvvaa0QuDeI12McNQdnTlWz9XlCa0uo,hWLurYddo88,Reinforcement Learning Agent - Self-driving cars with Carla and Python p.4,2019-08-22T14:46:53Z,36228,474,60,PT39M8S,hd,"['self-driving car', 'autonomous', 'vehicle', 'tutorial', 'python 3', 'carla']",en,False,Self-driving cars with Carla and Python,UCfzlCWGWYyIQ0aLC5w48gBQ,sentdex,2019-08-09T12:43:46Z,6
PLQVvvaa0QuDeI12McNQdnTlWz9XlCa0uo,MynOPIJi4VY,Running our Reinforcement Learning Agent - Self-driving cars with Carla and Python p.5,2019-08-28T14:32:23Z,44838,529,115,PT39M36S,hd,"['reinforcement learning', 'machine learning', 'ai', 'self-driving car', 'autonomous', 'vehicle', 'tutorial', 'python 3', 'carla']",en,False,Self-driving cars with Carla and Python,UCfzlCWGWYyIQ0aLC5w48gBQ,sentdex,2019-08-09T12:43:46Z,6
PLQVvvaa0QuDeI12McNQdnTlWz9XlCa0uo,6pEyGbCMl4U,Longer-term model results - Self-driving cars with Carla and Python p.6,2019-09-16T14:00:59Z,50122,553,66,PT20M26S,hd,"['python', 'self-driving cars', 'carla', 'tutorial', 'reinforcement learning']",en,False,Self-driving cars with Carla and Python,UCfzlCWGWYyIQ0aLC5w48gBQ,sentdex,2019-08-09T12:43:46Z,6
PLQVvvaa0QuDezJFIOU5wDdfy4e9vdnx-7,yMk_XtIEzH8,Q Learning Intro/Table - Reinforcement Learning p.1,2019-05-30T13:26:14Z,272834,4584,305,PT24M4S,hd,"['reinforcement learning', 'rl', 'tutorial', 'machine learning', 'python']",en,False,Reinforcement Learning,UCfzlCWGWYyIQ0aLC5w48gBQ,sentdex,2019-05-30T13:25:06Z,6
PLQVvvaa0QuDezJFIOU5wDdfy4e9vdnx-7,Gq1Azv_B4-4,Q Learning Algorithm and Agent  - Reinforcement Learning p.2,2019-05-31T13:34:38Z,97337,1664,181,PT28M58S,hd,"['reinforcement learning', 'rl', 'tutorial', 'machine learning', 'python']",en,False,Reinforcement Learning,UCfzlCWGWYyIQ0aLC5w48gBQ,sentdex,2019-05-30T13:25:06Z,6
PLQVvvaa0QuDezJFIOU5wDdfy4e9vdnx-7,CBTbifYx6a8,Q-Learning Agent Analysis - Reinforcement Learning p.3,2019-06-05T14:56:52Z,54156,1134,96,PT24M59S,hd,"['Q-learning', 'q learning', 'reinforcement learning', 'rl', 'tutorial', 'machine learning', 'python']",en,False,Reinforcement Learning,UCfzlCWGWYyIQ0aLC5w48gBQ,sentdex,2019-05-30T13:25:06Z,6
PLQVvvaa0QuDezJFIOU5wDdfy4e9vdnx-7,G92TF4xYQcU,Creating A Reinforcement Learning (RL) Environment - Reinforcement Learning p.4,2019-06-06T15:06:40Z,104552,1778,209,PT55M16S,hd,"['reinforcement learning', 'rl', 'tutorial', 'machine learning', 'python', 'Q-learning']",en,False,Reinforcement Learning,UCfzlCWGWYyIQ0aLC5w48gBQ,sentdex,2019-05-30T13:25:06Z,6
PLQVvvaa0QuDezJFIOU5wDdfy4e9vdnx-7,t3fbETsIBCY,Deep Q Learning w/ DQN - Reinforcement Learning p.5,2019-06-21T14:16:08Z,127095,1936,137,PT32M19S,hd,"['deep Q learning', 'dqn', 'deep reinforcement learning', 'deep', 'neural network', 'reinforcement learning', 'rl', 'tutorial', 'machine learning', 'python']",en,False,Reinforcement Learning,UCfzlCWGWYyIQ0aLC5w48gBQ,sentdex,2019-05-30T13:25:06Z,6
PLQVvvaa0QuDezJFIOU5wDdfy4e9vdnx-7,qfovbG84EBg,Training & Testing Deep reinforcement learning (DQN) Agent - Reinforcement Learning p.6,2019-06-22T13:14:50Z,78509,1300,246,PT48M37S,hd,"['dqn', 'deep q learning', 'reinforcement learning', 'rl', 'tutorial', 'machine learning', 'python']",en,False,Reinforcement Learning,UCfzlCWGWYyIQ0aLC5w48gBQ,sentdex,2019-05-30T13:25:06Z,6
PLQVvvaa0QuDf2_A04M-m0WubgLf2_geR6,GRtSc2Mp0WI,Introduction - JavaScript Programming Basics p.1,2019-05-16T13:37:50Z,51852,1370,247,PT19M45S,hd,"['javascript', 'programming', 'tutorial', 'code', 'basics']",en,False,JavaScript Basics,UCfzlCWGWYyIQ0aLC5w48gBQ,sentdex,2019-05-16T13:34:52Z,6
PLQVvvaa0QuDf2_A04M-m0WubgLf2_geR6,dxv3k4EIGfc,Functions and more Canvas - JavaScript Programming Basics p.2,2019-05-17T13:42:15Z,15357,360,65,PT11M23S,hd,"['functions', 'function', 'canvas', 'javascript', 'programming', 'tutorial', 'code', 'basics']",en,False,JavaScript Basics,UCfzlCWGWYyIQ0aLC5w48gBQ,sentdex,2019-05-16T13:34:52Z,6
PLQVvvaa0QuDf2_A04M-m0WubgLf2_geR6,_2vW0JE18pY,Running functions on an Interval with setInterval - JavaScript Programming Basics p.3,2019-05-18T13:25:12Z,12075,254,68,PT12M2S,hd,"['setinterval', 'interval', 'javascript', 'programming', 'tutorial', 'code', 'basics']",en,False,JavaScript Basics,UCfzlCWGWYyIQ0aLC5w48gBQ,sentdex,2019-05-16T13:34:52Z,6
PLQVvvaa0QuDf2_A04M-m0WubgLf2_geR6,HQTUwz1slAQ,Conditionals (if statement) - JavaScript Programming Basics p.4,2019-05-19T14:55:36Z,8767,211,44,PT11M5S,hd,"['if statement', 'conditional', 'javascript', 'programming', 'tutorial', 'code', 'basics']",en,False,JavaScript Basics,UCfzlCWGWYyIQ0aLC5w48gBQ,sentdex,2019-05-16T13:34:52Z,6
PLQVvvaa0QuDf2_A04M-m0WubgLf2_geR6,IsyyRKbFi7w,Object Oriented Programming in js - JavaScript Programming Basics p.5,2019-05-20T13:26:47Z,12336,289,65,PT16M19S,hd,"['OOP', 'object oriented programming', 'javascript', 'programming', 'tutorial', 'code', 'basics']",en,False,JavaScript Basics,UCfzlCWGWYyIQ0aLC5w48gBQ,sentdex,2019-05-16T13:34:52Z,6
PLQVvvaa0QuDf2_A04M-m0WubgLf2_geR6,ojyOVRAPT3Y,For Loops - JavaScript Programming Basics p.6,2019-05-21T14:45:23Z,9762,282,49,PT16M38S,hd,"['for', 'loop', 'for loop', 'foreach', 'javascript', 'programming', 'tutorial', 'code', 'basics']",en,False,JavaScript Basics,UCfzlCWGWYyIQ0aLC5w48gBQ,sentdex,2019-05-16T13:34:52Z,6
PLQVvvaa0QuDfWjcDi0GB1AsAuSCAb_JoX,Siyg1Wn5VDs,Building Search Word Database - Data Analysis of Google Tracking Takeout p.1,2019-05-06T13:43:12Z,17202,528,59,PT22M45S,hd,"['data analysis', 'google', 'takeout', 'search']",en,False,Analyzing Google Takeout Data,UCfzlCWGWYyIQ0aLC5w48gBQ,sentdex,2019-05-06T13:43:02Z,3
PLQVvvaa0QuDfWjcDi0GB1AsAuSCAb_JoX,msNAEaCTleQ,Creating Search Over Time Video Graphs - Data Analysis of Google Takeout p.2,2019-05-07T13:23:11Z,9724,246,40,PT33M16S,hd,"['data analysis', 'google', 'takeout', 'search']",en,False,Analyzing Google Takeout Data,UCfzlCWGWYyIQ0aLC5w48gBQ,sentdex,2019-05-06T13:43:02Z,3
PLQVvvaa0QuDfWjcDi0GB1AsAuSCAb_JoX,ixmGVL4dedI,Rosberg And Hamilton Clash On Last Lap | Austrian Grand Prix 2016,2017-01-30T14:03:59Z,8998194,55446,4203,PT2M20S,hd,"['F1', 'Sport', 'Sports', 'Action', 'GP', 'Grand Prix', 'Formula One', 'Formula 1', 'Auto Racing', 'Lewis Hamilton', 'Nico Rosberg', 'Mercedes', 'Mercedes F1', 'Austria', 'Austrian Grand Prix', 'Crash', 'F1 Crash', 'F1 2016', 'F1 Best of 2016', 'Hamilton', 'Rosberg']",en,False,Analyzing Google Takeout Data,UCfzlCWGWYyIQ0aLC5w48gBQ,sentdex,2019-05-06T13:43:02Z,3
PLQVvvaa0QuDfwnDTZWw8H3hN_VRQfq8rF,FjwD0SOGQ1k,Kivy Intro - Mobile and Desktop App Dev w/ Python,2019-04-23T13:22:29Z,243133,3518,302,PT14M6S,hd,"['kivy', 'python', 'app', 'application', 'windows', 'android', 'ios', 'mobile', 'dev']",en,False,Kivy - Mobile and Desktop App Dev w/ Python,UCfzlCWGWYyIQ0aLC5w48gBQ,sentdex,2019-04-23T13:21:15Z,7
PLQVvvaa0QuDfwnDTZWw8H3hN_VRQfq8rF,8I2fMqrruwc,Buttons & Events - Kivy Mobile and Desktop App Dev w/ Python,2019-04-24T13:15:21Z,62392,991,72,PT11M47S,hd,"['kivy', 'python', 'app', 'application', 'windows', 'android', 'ios', 'mobile', 'dev']",en,False,Kivy - Mobile and Desktop App Dev w/ Python,UCfzlCWGWYyIQ0aLC5w48gBQ,sentdex,2019-04-23T13:21:15Z,7
PLQVvvaa0QuDfwnDTZWw8H3hN_VRQfq8rF,sJmkhV02lnM,Changing Screen/view/page - Kivy Mobile and Desktop App Dev w/ Python,2019-04-25T12:58:17Z,45048,691,70,PT12M52S,hd,"['kivy', 'python', 'app', 'application', 'windows', 'android', 'ios', 'mobile', 'dev']",en,False,Kivy - Mobile and Desktop App Dev w/ Python,UCfzlCWGWYyIQ0aLC5w48gBQ,sentdex,2019-04-23T13:21:15Z,7
PLQVvvaa0QuDfwnDTZWw8H3hN_VRQfq8rF,hsnch676Lco,Scheduling tasks/functions/methods - Kivy Mobile and Desktop App Dev w/ Python,2019-04-26T14:23:24Z,32297,510,87,PT12M13S,hd,"['kivy', 'python', 'app', 'application', 'windows', 'android', 'ios', 'mobile', 'dev']",en,False,Kivy - Mobile and Desktop App Dev w/ Python,UCfzlCWGWYyIQ0aLC5w48gBQ,sentdex,2019-04-23T13:21:15Z,7
PLQVvvaa0QuDfwnDTZWw8H3hN_VRQfq8rF,62LSK62Gudc,Chat Application Page - Kivy Mobile and Desktop App Dev w/ Python,2019-04-29T15:14:13Z,37948,462,49,PT15M51S,hd,"['kivy', 'python', 'app', 'application', 'windows', 'android', 'ios', 'mobile', 'dev']",en,False,Kivy - Mobile and Desktop App Dev w/ Python,UCfzlCWGWYyIQ0aLC5w48gBQ,sentdex,2019-04-23T13:21:15Z,7
PLQVvvaa0QuDfwnDTZWw8H3hN_VRQfq8rF,lmWE2bydekk,Finishing Chat Application - Kivy Mobile and Desktop App Dev w/ Python,2019-04-30T13:10:18Z,42647,420,65,PT15M21S,hd,"['kivy', 'python', 'app', 'application', 'windows', 'android', 'ios', 'mobile', 'dev']",en,False,Kivy - Mobile and Desktop App Dev w/ Python,UCfzlCWGWYyIQ0aLC5w48gBQ,sentdex,2019-04-23T13:21:15Z,7
PLQVvvaa0QuDfwnDTZWw8H3hN_VRQfq8rF,CIW0H70wo0M,Android deployment - Kivy Mobile and Desktop App Dev w/ Python,2019-05-01T14:30:27Z,75206,898,132,PT12M35S,hd,"['Android', 'deploy', 'package', 'buildozer', 'kivy', 'python', 'app', 'application', 'windows', 'android', 'ios', 'mobile', 'dev']",en,False,Kivy - Mobile and Desktop App Dev w/ Python,UCfzlCWGWYyIQ0aLC5w48gBQ,sentdex,2019-04-23T13:21:15Z,7
PLQVvvaa0QuDdzLB_0JSTTcl8E8jsJLhR5,Lbfe3-v7yE0,Sockets Tutorial with Python 3 part 1 - sending and receiving data,2019-03-11T14:22:40Z,764643,12546,629,PT14M27S,hd,"['sockets', 'python 3', 'python', 'programming', 'tutorial', 'networking', 'socket', 'send', 'recv']",en,False,Sockets with Python 3,UCfzlCWGWYyIQ0aLC5w48gBQ,sentdex,2019-03-11T14:00:42Z,5
PLQVvvaa0QuDdzLB_0JSTTcl8E8jsJLhR5,8A4dqoGL62E,Sockets Tutorial with Python 3 part 2 - buffering and streaming data,2019-03-12T17:39:40Z,242556,3880,227,PT14M46S,hd,"['sockets', 'python 3', 'python', 'programming', 'tutorial', 'networking', 'socket', 'send', 'recv', 'buffer']",en,False,Sockets with Python 3,UCfzlCWGWYyIQ0aLC5w48gBQ,sentdex,2019-03-11T14:00:42Z,5
