playlist_id,video_id,title,published,view_count,like_count,comment_count,duration,definition,tags,default_audio_language,madeforkid,playlist_title,channel_id,channelTitle,playlist_published,playlist_numvideo
PLQVvvaa0QuDcT3tPehHdisGMc8TInNqdq,ycmgbUd8LQI,Building Neural Network Training data - Python AI in StarCraft II tutorial p.9,2018-07-08T12:38:12Z,39261,537,142,PT24M53S,hd,"['starcraft II', 'python', 'deep learning', 'neural network', 'tensorflow', 'keras', 'pysc2', 'python-sc2', 'artificial intelligence', 'machine learning', 'tutorial']",en,False,Python AI in StarCraft II,UCfzlCWGWYyIQ0aLC5w48gBQ,sentdex,2018-06-21T13:23:24Z,17
PLQVvvaa0QuDcT3tPehHdisGMc8TInNqdq,lCTn3dVc1_M,Building Neural Network Model - Python AI in StarCraft II tutorial p.10,2018-07-13T13:24:33Z,17618,325,64,PT13M37S,hd,"['starcraft II', 'python', 'deep learning', 'neural network', 'tensorflow', 'keras', 'pysc2', 'python-sc2', 'artificial intelligence', 'machine learning', 'tutorial']",en,False,Python AI in StarCraft II,UCfzlCWGWYyIQ0aLC5w48gBQ,sentdex,2018-06-21T13:23:24Z,17
PLQVvvaa0QuDcT3tPehHdisGMc8TInNqdq,IgnYjgpGSzE,Training Neural Network - Python AI in StarCraft II tutorial p.11,2018-07-14T13:37:00Z,20395,351,76,PT22M52S,hd,"['starcraft II', 'python', 'deep learning', 'neural network', 'tensorflow', 'keras', 'pysc2', 'python-sc2', 'artificial intelligence', 'machine learning', 'tutorial']",en,False,Python AI in StarCraft II,UCfzlCWGWYyIQ0aLC5w48gBQ,sentdex,2018-06-21T13:23:24Z,17
PLQVvvaa0QuDcT3tPehHdisGMc8TInNqdq,D5c2xJQH3Ag,Testing Neural Network - Python AI in StarCraft II tutorial p.12,2018-07-15T13:36:39Z,21333,407,103,PT15M47S,hd,"['starcraft II', 'python', 'deep learning', 'neural network', 'tensorflow', 'keras', 'pysc2', 'python-sc2', 'artificial intelligence', 'machine learning', 'tutorial']",en,False,Python AI in StarCraft II,UCfzlCWGWYyIQ0aLC5w48gBQ,sentdex,2018-06-21T13:23:24Z,17
PLQVvvaa0QuDcT3tPehHdisGMc8TInNqdq,zt97GlmjQbY,Version 2 Changes - Python AI in StarCraft II tutorial p.13,2018-07-21T14:55:04Z,9228,217,59,PT9M,hd,"['starcraft II', 'python', 'deep learning', 'neural network', 'tensorflow', 'keras', 'pysc2', 'python-sc2', 'artificial intelligence', 'machine learning', 'tutorial']",en,False,Python AI in StarCraft II,UCfzlCWGWYyIQ0aLC5w48gBQ,sentdex,2018-06-21T13:23:24Z,17
PLQVvvaa0QuDcT3tPehHdisGMc8TInNqdq,81JULbBnv0A,Improving Scouting - Python AI in StarCraft II tutorial p.14,2018-07-22T14:27:26Z,10032,235,70,PT23M5S,hd,"['starcraft II', 'python', 'deep learning', 'neural network', 'tensorflow', 'keras', 'pysc2', 'python-sc2', 'artificial intelligence', 'machine learning', 'tutorial']",en,False,Python AI in StarCraft II,UCfzlCWGWYyIQ0aLC5w48gBQ,sentdex,2018-06-21T13:23:24Z,17
PLQVvvaa0QuDcT3tPehHdisGMc8TInNqdq,eOv1aPRE1jo,More Choices for AI - Python AI in StarCraft II tutorial p.15,2018-07-31T17:12:21Z,12078,221,46,PT10M3S,hd,"['starcraft II', 'python', 'deep learning', 'neural network', 'tensorflow', 'keras', 'pysc2', 'python-sc2', 'artificial intelligence', 'machine learning', 'tutorial']",en,False,Python AI in StarCraft II,UCfzlCWGWYyIQ0aLC5w48gBQ,sentdex,2018-06-21T13:23:24Z,17
PLQVvvaa0QuDcT3tPehHdisGMc8TInNqdq,6N1bsDNAIB8,Visualization Changes - Python AI in StarCraft II tutorial p.16,2018-08-01T14:49:07Z,12011,170,30,PT9M1S,hd,"['starcraft II', 'python', 'deep learning', 'neural network', 'tensorflow', 'keras', 'pysc2', 'python-sc2', 'artificial intelligence', 'machine learning', 'tutorial']",en,False,Python AI in StarCraft II,UCfzlCWGWYyIQ0aLC5w48gBQ,sentdex,2018-06-21T13:23:24Z,17
PLQVvvaa0QuDcT3tPehHdisGMc8TInNqdq,oi6QBUZUgbc,Results - Python AI in StarCraft II tutorial p.17,2018-08-02T20:54:15Z,20781,250,117,PT9M43S,hd,"['starcraft II', 'python', 'deep learning', 'neural network', 'tensorflow', 'keras', 'pysc2', 'python-sc2', 'artificial intelligence', 'machine learning', 'tutorial']",en,False,Python AI in StarCraft II,UCfzlCWGWYyIQ0aLC5w48gBQ,sentdex,2018-06-21T13:23:24Z,17
PLQVvvaa0QuDcsopCRwbxxVZtJmHplV3uZ,Bc8UC_m7M_Y,Deep Learning in the Browser with TensorFlow.js Introduction p.1,2018-06-15T14:36:48Z,38277,590,106,PT26M31S,hd,"['tensorflow.js', 'tensorflow', 'deep learning', 'machine learning', 'tutorial']",en,False,TensorFlow.js - Deep Learning in the Browser,UCfzlCWGWYyIQ0aLC5w48gBQ,sentdex,2018-06-15T14:36:37Z,4
PLQVvvaa0QuDcsopCRwbxxVZtJmHplV3uZ,bOwKPsCj2GQ,Basic TensorFlow.js Web Application - TensorFlow.js p.2,2018-06-16T13:44:56Z,22263,333,53,PT27M52S,hd,"['python', 'tensorflow', 'deep learning', 'neural network', 'tutorial']",en,False,TensorFlow.js - Deep Learning in the Browser,UCfzlCWGWYyIQ0aLC5w48gBQ,sentdex,2018-06-15T14:36:37Z,4
PLQVvvaa0QuDcsopCRwbxxVZtJmHplV3uZ,iCWrRrze9No,AI Pong - TensorFlow.js p.3,2018-06-17T12:54:07Z,20178,322,43,PT15M47S,hd,"['tensorflow.js', 'tensorflow', 'deep learning', 'machine learning', 'tutorial']",en,False,TensorFlow.js - Deep Learning in the Browser,UCfzlCWGWYyIQ0aLC5w48gBQ,sentdex,2018-06-15T14:36:37Z,4
PLQVvvaa0QuDcsopCRwbxxVZtJmHplV3uZ,Szjt8E7EKQc,Training model in Python and Loading into TensorFlow.js - TensorFlow.js p.4,2018-06-18T13:29:48Z,28681,389,65,PT19M54S,hd,"['tensorflow.js', 'tensorflow', 'deep learning', 'machine learning', 'tutorial']",en,False,TensorFlow.js - Deep Learning in the Browser,UCfzlCWGWYyIQ0aLC5w48gBQ,sentdex,2018-06-15T14:36:37Z,4
PLQVvvaa0QuDebFAC20X4iyF0KR-s9LGnu,gRzqsW9Rj3E,Intro and Overview of uArm Swift Pro - Teaching a Robotic Arm to Play Air Hockey,2018-05-22T12:54:22Z,33855,530,82,PT16M1S,hd,"['python', 'programming', 'tutorial', 'robot', 'robotic arm', 'uarm', 'uarm swift', 'pro']",en,False,uArm Robotic Arm Tinkering,UCfzlCWGWYyIQ0aLC5w48gBQ,sentdex,2018-05-23T01:48:47Z,4
PLQVvvaa0QuDebFAC20X4iyF0KR-s9LGnu,Gn-vfxs_sjg,Filtering for Puck - Teaching a Robotic Arm to Play Air Hockey p.2,2018-05-23T13:49:07Z,9042,219,47,PT17M57S,hd,"['python', 'programming', 'tutorial', 'robot', 'robotic arm', 'uarm', 'uarm swift', 'pro']",en,False,uArm Robotic Arm Tinkering,UCfzlCWGWYyIQ0aLC5w48gBQ,sentdex,2018-05-23T01:48:47Z,4
PLQVvvaa0QuDebFAC20X4iyF0KR-s9LGnu,hrn5q-E7j_0,Puck location and cleanup - Teaching a Robotic Arm to Play Air Hockey p.3,2018-05-24T14:27:29Z,9678,221,48,PT13M58S,hd,"['python', 'programming', 'tutorial', 'robot', 'robotic arm', 'uarm', 'uarm swift', 'pro']",en,False,uArm Robotic Arm Tinkering,UCfzlCWGWYyIQ0aLC5w48gBQ,sentdex,2018-05-23T01:48:47Z,4
PLQVvvaa0QuDebFAC20X4iyF0KR-s9LGnu,9f9IxdlM8PI,Basic Playing - Teaching a Robotic Arm to Play Air Hockey p.4,2018-05-25T13:34:58Z,11038,213,26,PT10M33S,hd,"['python', 'programming', 'tutorial', 'robot', 'robotic arm', 'uarm', 'uarm swift', 'pro']",en,False,uArm Robotic Arm Tinkering,UCfzlCWGWYyIQ0aLC5w48gBQ,sentdex,2018-05-23T01:48:47Z,4
PLQVvvaa0QuDdfN3lrO0NDYxa1JwCYes-E,a7Og0ImTg9Q,Generative Model Basics - Unconventional Neural Networks p.1,2018-04-04T13:09:10Z,48858,1046,128,PT14M12S,hd,"['python', 'tensorflow', 'deep learning', 'neural network', 'tutorial']",en,False,Unconventional Neural Networks,UCfzlCWGWYyIQ0aLC5w48gBQ,sentdex,2018-04-04T13:10:26Z,12
PLQVvvaa0QuDdfN3lrO0NDYxa1JwCYes-E,gmQHBWrR4AY,Generating Pythonic code with Neural Network - Unconventional Neural Networks p.2,2018-04-05T13:07:26Z,18228,454,82,PT19M47S,hd,"['python', 'tensorflow', 'deep learning', 'neural network', 'tutorial']",en,False,Unconventional Neural Networks,UCfzlCWGWYyIQ0aLC5w48gBQ,sentdex,2018-04-04T13:10:26Z,12
PLQVvvaa0QuDdfN3lrO0NDYxa1JwCYes-E,dmLBvRnlFHk,Generating with MNIST - Unconventional Neural Networks p.3,2018-04-06T14:04:34Z,10502,221,32,PT10M16S,hd,"['python', 'tensorflow', 'deep learning', 'neural network', 'tutorial']",en,False,Unconventional Neural Networks,UCfzlCWGWYyIQ0aLC5w48gBQ,sentdex,2018-04-04T13:10:26Z,12
PLQVvvaa0QuDdfN3lrO0NDYxa1JwCYes-E,ekp6m0zTSUY,Classification Generator Training Attempt - Unconventional Neural Networks p.4,2018-04-07T13:08:05Z,8756,197,32,PT18M58S,hd,"['python', 'tensorflow', 'deep learning', 'neural network', 'tutorial']",en,False,Unconventional Neural Networks,UCfzlCWGWYyIQ0aLC5w48gBQ,sentdex,2018-04-04T13:10:26Z,12
PLQVvvaa0QuDdfN3lrO0NDYxa1JwCYes-E,_vIEOUQESSg,Classification Generator Testing Attempt - Unconventional Neural Networks p.5,2018-04-08T13:43:46Z,6956,146,29,PT12M6S,hd,"['python', 'tensorflow', 'deep learning', 'neural network', 'tutorial']",en,False,Unconventional Neural Networks,UCfzlCWGWYyIQ0aLC5w48gBQ,sentdex,2018-04-04T13:10:26Z,12
PLQVvvaa0QuDdfN3lrO0NDYxa1JwCYes-E,1xyhgFXhXG8,Drawing a Number by Request with Generative Model - Unconventional Neural Networks p.6,2018-04-09T13:15:21Z,6698,125,38,PT9M21S,hd,"['python', 'tensorflow', 'deep learning', 'neural network', 'tutorial']",en,False,Unconventional Neural Networks,UCfzlCWGWYyIQ0aLC5w48gBQ,sentdex,2018-04-04T13:10:26Z,12
PLQVvvaa0QuDdfN3lrO0NDYxa1JwCYes-E,ijhDHnWfsWw,Deep Dream - Unconventional Neural Networks p.7,2018-04-12T13:19:14Z,13608,259,38,PT12M48S,hd,"['python', 'tensorflow', 'deep learning', 'neural network', 'tutorial']",en,False,Unconventional Neural Networks,UCfzlCWGWYyIQ0aLC5w48gBQ,sentdex,2018-04-04T13:10:26Z,12
PLQVvvaa0QuDdfN3lrO0NDYxa1JwCYes-E,VTzUhMB0ibc,Deep Dream Frames- Unconventional Neural Networks p.8,2018-04-13T13:16:01Z,6924,150,19,PT9M36S,hd,"['python', 'tensorflow', 'deep learning', 'neural network', 'tutorial']",en,False,Unconventional Neural Networks,UCfzlCWGWYyIQ0aLC5w48gBQ,sentdex,2018-04-04T13:10:26Z,12
PLQVvvaa0QuDdfN3lrO0NDYxa1JwCYes-E,GTUHLHhFC4k,Deep Dream Video- Unconventional Neural Networks p.9,2018-04-14T14:36:10Z,10295,183,38,PT8M57S,hd,"['python', 'tensorflow', 'deep learning', 'neural network', 'tutorial']",en,False,Unconventional Neural Networks,UCfzlCWGWYyIQ0aLC5w48gBQ,sentdex,2018-04-04T13:10:26Z,12
PLQVvvaa0QuDdfN3lrO0NDYxa1JwCYes-E,Cp7fayS7bNY,Doing Math with Deep Learning (Addition)- Unconventional Neural Networks p.10,2018-04-15T13:30:00Z,9079,182,46,PT15M33S,hd,"['python', 'tensorflow', 'deep learning', 'neural network', 'tutorial']",en,False,Unconventional Neural Networks,UCfzlCWGWYyIQ0aLC5w48gBQ,sentdex,2018-04-04T13:10:26Z,12
PLQVvvaa0QuDdfN3lrO0NDYxa1JwCYes-E,yfsM202fZgM,More Complex Math with Deep Learning - Unconventional Neural Networks p.11,2018-04-16T12:53:35Z,7198,144,42,PT24M43S,hd,"['python', 'tensorflow', 'deep learning', 'neural network', 'tutorial']",en,False,Unconventional Neural Networks,UCfzlCWGWYyIQ0aLC5w48gBQ,sentdex,2018-04-04T13:10:26Z,12
PLQVvvaa0QuDdfN3lrO0NDYxa1JwCYes-E,IrbpMFJ_Trg,Complex Math Results - Unconventional Neural Networks p.12,2018-04-17T12:42:07Z,9724,156,47,PT16M26S,hd,"['python', 'tensorflow', 'deep learning', 'neural network', 'tutorial']",en,False,Unconventional Neural Networks,UCfzlCWGWYyIQ0aLC5w48gBQ,sentdex,2018-04-04T13:10:26Z,12
PLQVvvaa0QuDfsGImWNt1eUEveHOepkjqt,J_Cy_QjG6NE,Intro - Data Visualization GUIs with Dash and Python p.1,2018-02-12T15:43:43Z,205022,2845,246,PT17M25S,hd,"['Dash', 'Python', 'programming', 'tutorials', 'data visualization', 'react', 'GUI', 'application', 'data analysis']",en,False,Data Visualization GUIs with Dash and Python,UCfzlCWGWYyIQ0aLC5w48gBQ,sentdex,2018-02-12T15:43:30Z,12
PLQVvvaa0QuDfsGImWNt1eUEveHOepkjqt,hRH01ZzT2NI,Interactive User Interface - Data Visualization GUIs with Dash and Python p.2,2018-02-13T14:28:06Z,70018,733,43,PT8M17S,hd,"['Dash', 'Python', 'programming', 'tutorials', 'data visualization', 'react', 'GUI', 'application', 'data analysis']",en,False,Data Visualization GUIs with Dash and Python,UCfzlCWGWYyIQ0aLC5w48gBQ,sentdex,2018-02-12T15:43:30Z,12
PLQVvvaa0QuDfsGImWNt1eUEveHOepkjqt,wv2MXJIdKRY,Dynamic Graph based on User Input - Data Visualization GUIs with Dash and Python p.3,2018-02-14T14:34:49Z,107033,1099,158,PT16M31S,hd,"['Dash', 'Python', 'programming', 'tutorials', 'data visualization', 'react', 'GUI', 'application', 'data analysis']",en,False,Data Visualization GUIs with Dash and Python,UCfzlCWGWYyIQ0aLC5w48gBQ,sentdex,2018-02-12T15:43:30Z,12
PLQVvvaa0QuDfsGImWNt1eUEveHOepkjqt,37Zj955LFT0,Live Graphs with Events - Data Visualization GUIs with Dash and Python p.4,2018-02-15T14:06:12Z,97239,1005,132,PT18M6S,hd,"['Dash', 'Python', 'programming', 'tutorials', 'data visualization', 'react', 'GUI', 'application', 'data analysis', 'live']",en,False,Data Visualization GUIs with Dash and Python,UCfzlCWGWYyIQ0aLC5w48gBQ,sentdex,2018-02-12T15:43:30Z,12
PLQVvvaa0QuDfsGImWNt1eUEveHOepkjqt,luixWRpp6Jo,Vehicle sensor data App Example - Data Visualization GUIs with Dash and Python p.5,2018-02-16T14:11:02Z,45924,595,107,PT25M2S,hd,"['Dash', 'Python', 'programming', 'tutorials', 'data visualization', 'react', 'GUI', 'application', 'data analysis']",en,False,Data Visualization GUIs with Dash and Python,UCfzlCWGWYyIQ0aLC5w48gBQ,sentdex,2018-02-12T15:43:30Z,12
PLQVvvaa0QuDfsGImWNt1eUEveHOepkjqt,qTyj2R-wcks,Sentiment Analysis in Python with TextBlob and VADER Sentiment (also Dash p.6),2018-02-27T17:03:29Z,72840,1108,96,PT23M25S,hd,"['sentiment', 'analysis', 'textblob', 'vader sentiment', 'vadersentiment', 'Dash', 'Python', 'programming', 'tutorials', 'data visualization', 'react', 'GUI', 'application', 'data analysis']",en,False,Data Visualization GUIs with Dash and Python,UCfzlCWGWYyIQ0aLC5w48gBQ,sentdex,2018-02-12T15:43:30Z,12
PLQVvvaa0QuDfsGImWNt1eUEveHOepkjqt,YKYnhNSr9X8,Streaming Tweets and Sentiment - Data Visualization GUIs with Dash and Python p.7,2018-02-28T14:14:43Z,24829,264,35,PT14M36S,hd,"['Dash', 'Python', 'programming', 'tutorials', 'sentiment', 'data visualization', 'react', 'GUI', 'application', 'data analysis']",en,False,Data Visualization GUIs with Dash and Python,UCfzlCWGWYyIQ0aLC5w48gBQ,sentdex,2018-02-12T15:43:30Z,12
PLQVvvaa0QuDfsGImWNt1eUEveHOepkjqt,a8oJLbI03mg,Reading from our sentiment database - Data Visualization GUIs with Dash and Python p.8,2018-03-01T14:46:27Z,15230,147,19,PT5M17S,hd,"['Dash', 'Python', 'programming', 'tutorials', 'sentiment', 'data visualization', 'react', 'GUI', 'application', 'data analysis']",en,False,Data Visualization GUIs with Dash and Python,UCfzlCWGWYyIQ0aLC5w48gBQ,sentdex,2018-02-12T15:43:30Z,12
PLQVvvaa0QuDfsGImWNt1eUEveHOepkjqt,bz2zqXFjOrE,Live Twitter Sentiment Graph - Data Visualization GUIs with Dash and Python p.9,2018-03-02T15:36:19Z,27249,326,35,PT10M9S,hd,"['Dash', 'Python', 'programming', 'tutorials', 'sentiment', 'data visualization', 'react', 'GUI', 'application', 'data analysis']",en,False,Data Visualization GUIs with Dash and Python,UCfzlCWGWYyIQ0aLC5w48gBQ,sentdex,2018-02-12T15:43:30Z,12
PLQVvvaa0QuDfsGImWNt1eUEveHOepkjqt,K6ixFSxZAX0,Dynamically Graphing Terms for Sentiment - Data Visualization GUIs with Dash and Python p.10,2018-03-03T14:51:59Z,18367,205,44,PT18M19S,hd,"['Dash', 'Python', 'programming', 'tutorials', 'sentiment', 'data visualization', 'react', 'GUI', 'application', 'data analysis']",en,False,Data Visualization GUIs with Dash and Python,UCfzlCWGWYyIQ0aLC5w48gBQ,sentdex,2018-02-12T15:43:30Z,12
PLQVvvaa0QuDfsGImWNt1eUEveHOepkjqt,tpn-5qPnrrc,Deploy Dash App - Data Visualization GUIs with Dash and Python p.11,2018-03-12T13:59:57Z,38120,364,82,PT26M48S,hd,"['deploy', 'vps', 'webserver', 'launch', 'Dash', 'Python', 'programming', 'tutorials', 'sentiment', 'data visualization', 'react', 'GUI', 'application', 'data analysis']",en,False,Data Visualization GUIs with Dash and Python,UCfzlCWGWYyIQ0aLC5w48gBQ,sentdex,2018-02-12T15:43:30Z,12
PLQVvvaa0QuDfsGImWNt1eUEveHOepkjqt,rDodciQhfS8,Full Dash App - Data Visualization GUIs with Dash and Python p.12,2018-03-15T13:37:35Z,106417,1108,77,PT15M37S,hd,"['dash', 'python', 'plotly', 'dashboard', 'data visualization', 'gui', 'application', 'data analysis']",en,False,Data Visualization GUIs with Dash and Python,UCfzlCWGWYyIQ0aLC5w48gBQ,sentdex,2018-02-12T15:43:30Z,12
PLQVvvaa0QuDeIXLGcc7ZxHSCq8br_d1P-,QjAu5lJo4zs,Introduction - Halite II 2017 Artificial Intelligence Competition p.1,2017-12-22T15:09:34Z,49129,822,54,PT4M51S,hd,"['halite', 'two sigma', 'artificial intelligence', 'ai', 'competition', 'challenge', 'machine learning', 'python', 'tutorial']",en,False,Halite II AI competition,UCfzlCWGWYyIQ0aLC5w48gBQ,sentdex,2017-12-22T15:09:23Z,7
PLQVvvaa0QuDeIXLGcc7ZxHSCq8br_d1P-,0SVkERzPCSQ,Modifying Starter Bot - Halite II 2017 Artificial Intelligence Competition p.2,2017-12-22T15:16:17Z,23790,507,77,PT12M36S,hd,"['halite', 'two sigma', 'artificial intelligence', 'ai', 'competition', 'challenge', 'machine learning', 'python', 'tutorial']",en,False,Halite II AI competition,UCfzlCWGWYyIQ0aLC5w48gBQ,sentdex,2017-12-22T15:09:23Z,7
PLQVvvaa0QuDeIXLGcc7ZxHSCq8br_d1P-,vC3lQ3ZJE2Y,Custom Bot - Halite II 2017 Artificial Intelligence Competition p.3,2017-12-23T14:36:00Z,22470,479,89,PT24M41S,hd,"['halite', 'two sigma', 'artificial intelligence', 'ai', 'competition', 'challenge', 'machine learning', 'python', 'tutorial']",en,False,Halite II AI competition,UCfzlCWGWYyIQ0aLC5w48gBQ,sentdex,2017-12-22T15:09:23Z,7
PLQVvvaa0QuDeIXLGcc7ZxHSCq8br_d1P-,KPBRWF7ALPQ,Deep Learning - Halite II 2017 Artificial Intelligence Competition p.4,2018-01-09T18:46:12Z,13836,364,38,PT29M49S,hd,"['halite', 'two sigma', 'deep learning', 'tensorflow', 'keras', 'artificial intelligence', 'ai', 'competition', 'challenge', 'machine learning', 'python', 'tutorial']",en,False,Halite II AI competition,UCfzlCWGWYyIQ0aLC5w48gBQ,sentdex,2017-12-22T15:09:23Z,7
PLQVvvaa0QuDeIXLGcc7ZxHSCq8br_d1P-,OByH7g6T5-A,Training Data - Halite II 2017 Artificial Intelligence Competition p.5,2018-01-10T14:28:10Z,9686,241,55,PT16M,hd,"['halite', 'two sigma', 'deep learning', 'tensorflow', 'keras', 'artificial intelligence', 'ai', 'competition', 'challenge', 'machine learning', 'python', 'tutorial']",en,False,Halite II AI competition,UCfzlCWGWYyIQ0aLC5w48gBQ,sentdex,2017-12-22T15:09:23Z,7
PLQVvvaa0QuDeIXLGcc7ZxHSCq8br_d1P-,kA3gC-IMZZY,Training Model - Halite II 2017 Artificial Intelligence Competition p.6,2018-01-11T14:35:08Z,9356,213,40,PT18M52S,hd,"['halite', 'two sigma', 'deep learning', 'tensorflow', 'keras', 'artificial intelligence', 'ai', 'competition', 'challenge', 'machine learning', 'python', 'tutorial']",en,False,Halite II AI competition,UCfzlCWGWYyIQ0aLC5w48gBQ,sentdex,2017-12-22T15:09:23Z,7
PLQVvvaa0QuDeIXLGcc7ZxHSCq8br_d1P-,7UqRgcd0GwM,Deploying Model - Halite II 2017 Artificial Intelligence Competition p.7,2018-01-12T14:13:03Z,14064,219,66,PT18M23S,hd,"['halite', 'two sigma', 'deep learning', 'tensorflow', 'keras', 'artificial intelligence', 'ai', 'competition', 'challenge', 'machine learning', 'python', 'tutorial']",en,False,Halite II AI competition,UCfzlCWGWYyIQ0aLC5w48gBQ,sentdex,2017-12-22T15:09:23Z,7
PLQVvvaa0QuDdc2k5dwtDTyT9aCja0on8j,dvOnYLDg8_Y,"Creating a Chatbot with Deep Learning, Python, and TensorFlow p.1",2017-11-24T15:26:34Z,636711,7944,431,PT9M13S,hd,"['chatbot', 'Python', 'tensorflow', 'deep learning', 'sequence to sequence', 'seq2seq', 'artificial intelligence', 'machine learning', 'tutorial', 'programming', 'chat', 'bot']",en,False,"Creating a Chatbot with Deep Learning, Python, and TensorFlo",UCfzlCWGWYyIQ0aLC5w48gBQ,sentdex,2017-11-24T15:26:05Z,9
PLQVvvaa0QuDdc2k5dwtDTyT9aCja0on8j,K2hFNFN9lRc,"Data Structure - Creating a Chatbot with Deep Learning, Python, and TensorFlow p.2",2017-11-25T14:39:06Z,201924,1924,133,PT9M48S,hd,"['chatbot', 'Python', 'tensorflow', 'deep learning', 'sequence to sequence', 'seq2seq', 'artificial intelligence', 'machine learning', 'tutorial', 'programming', 'chat', 'bot']",en,False,"Creating a Chatbot with Deep Learning, Python, and TensorFlo",UCfzlCWGWYyIQ0aLC5w48gBQ,sentdex,2017-11-24T15:26:05Z,9
PLQVvvaa0QuDdc2k5dwtDTyT9aCja0on8j,gQjvotqlvjs,"Buffering dataset - Creating a Chatbot with Deep Learning, Python, and TensorFlow p.3",2017-11-25T15:00:13Z,109889,1142,148,PT11M37S,hd,"['chatbot', 'Python', 'tensorflow', 'deep learning', 'sequence to sequence', 'seq2seq', 'artificial intelligence', 'machine learning', 'tutorial', 'programming', 'chat', 'bot']",en,False,"Creating a Chatbot with Deep Learning, Python, and TensorFlo",UCfzlCWGWYyIQ0aLC5w48gBQ,sentdex,2017-11-24T15:26:05Z,9
PLQVvvaa0QuDdc2k5dwtDTyT9aCja0on8j,krxuhSARhAs,"Determining insert - Creating a Chatbot with Deep Learning, Python, and TensorFlow p.4",2017-11-26T15:14:58Z,76454,781,120,PT7M48S,hd,"['chatbot', 'Python', 'tensorflow', 'deep learning', 'sequence to sequence', 'seq2seq', 'artificial intelligence', 'machine learning', 'tutorial', 'programming', 'chat', 'bot']",en,False,"Creating a Chatbot with Deep Learning, Python, and TensorFlo",UCfzlCWGWYyIQ0aLC5w48gBQ,sentdex,2017-11-24T15:26:05Z,9
PLQVvvaa0QuDdc2k5dwtDTyT9aCja0on8j,9os9uQJqDbI,"Building Database - Creating a Chatbot with Deep Learning, Python, and TensorFlow p.5",2017-11-27T16:33:39Z,88395,932,474,PT18M57S,hd,"['chatbot', 'Python', 'tensorflow', 'deep learning', 'sequence to sequence', 'seq2seq', 'artificial intelligence', 'machine learning', 'tutorial', 'programming', 'chat', 'bot']",en,False,"Creating a Chatbot with Deep Learning, Python, and TensorFlo",UCfzlCWGWYyIQ0aLC5w48gBQ,sentdex,2017-11-24T15:26:05Z,9
PLQVvvaa0QuDdc2k5dwtDTyT9aCja0on8j,tw8G8-KMRf8,"Database to Training Data - Creating a Chatbot with Deep Learning, Python, and TensorFlow p.6",2017-12-02T13:28:23Z,76349,829,214,PT12M29S,hd,"['chatbot', 'Python', 'tensorflow', 'deep learning', 'sequence to sequence', 'seq2seq', 'artificial intelligence', 'machine learning', 'tutorial', 'programming', 'chat', 'bot']",en,False,"Creating a Chatbot with Deep Learning, Python, and TensorFlo",UCfzlCWGWYyIQ0aLC5w48gBQ,sentdex,2017-11-24T15:26:05Z,9
PLQVvvaa0QuDdc2k5dwtDTyT9aCja0on8j,040CfFRJ9Rs,"Training a Model - Creating a Chatbot with Deep Learning, Python, and TensorFlow p.7",2017-12-03T14:12:45Z,88347,831,397,PT17M21S,hd,"['chatbot', 'Python', 'tensorflow', 'deep learning', 'sequence to sequence', 'seq2seq', 'artificial intelligence', 'machine learning', 'tutorial', 'programming', 'chat', 'bot']",en,False,"Creating a Chatbot with Deep Learning, Python, and TensorFlo",UCfzlCWGWYyIQ0aLC5w48gBQ,sentdex,2017-11-24T15:26:05Z,9
PLQVvvaa0QuDdc2k5dwtDTyT9aCja0on8j,gFxiQXnt9w4,"NMT Concepts and Parameters - Creating a Chatbot with Deep Learning, Python, and TensorFlow p.8",2017-12-04T18:44:59Z,56262,562,157,PT28M17S,hd,"['neural machine translation', 'nmt', 'chatbot', 'Python', 'tensorflow', 'deep learning', 'sequence to sequence', 'seq2seq', 'artificial intelligence', 'machine learning', 'tutorial', 'programming', 'chat', 'bot']",en,False,"Creating a Chatbot with Deep Learning, Python, and TensorFlo",UCfzlCWGWYyIQ0aLC5w48gBQ,sentdex,2017-11-24T15:26:05Z,9
PLQVvvaa0QuDdc2k5dwtDTyT9aCja0on8j,bdeZ_h9-h4o,"Interacting with our Chatbot - Creating a Chatbot with Deep Learning, Python, and TensorFlow p.9",2017-12-15T14:37:56Z,100057,886,220,PT20M31S,hd,"['neural machine translation', 'nmt', 'chatbot', 'Python', 'tensorflow', 'deep learning', 'sequence to sequence', 'seq2seq', 'artificial intelligence', 'machine learning', 'tutorial', 'programming', 'chat', 'bot']",en,False,"Creating a Chatbot with Deep Learning, Python, and TensorFlo",UCfzlCWGWYyIQ0aLC5w48gBQ,sentdex,2017-11-24T15:26:05Z,9
PLQVvvaa0QuDeF3hP0wQoSxpkqgRcgxMqX,G3PvTWRIhZA,Introduction - Go Lang Practical Programming Tutorial p.1,2017-10-21T17:58:19Z,329343,3160,220,PT7M25S,hd,"['Go', 'Go lang', 'go programming', 'tutorial', 'programming', 'introduction']",en,False,Go Language Programming Practical Basics Tutorial,UCfzlCWGWYyIQ0aLC5w48gBQ,sentdex,2017-10-21T17:58:13Z,24
PLQVvvaa0QuDeF3hP0wQoSxpkqgRcgxMqX,nSYFfWijl8U,Syntax - Go Lang Practical Programming Tutorial p.2,2017-10-21T17:58:44Z,118560,1338,103,PT9M16S,hd,"['Go', 'Go lang', 'go programming', 'tutorial', 'programming', 'syntax']",en,False,Go Language Programming Practical Basics Tutorial,UCfzlCWGWYyIQ0aLC5w48gBQ,sentdex,2017-10-21T17:58:13Z,24
PLQVvvaa0QuDeF3hP0wQoSxpkqgRcgxMqX,ZCceigT2A6I,Types - Go Lang Practical Programming Tutorial p.3,2017-10-21T17:58:49Z,83209,1096,65,PT11M23S,hd,"['types', 'Go', 'Go lang', 'go programming', 'tutorial', 'programming']",en,False,Go Language Programming Practical Basics Tutorial,UCfzlCWGWYyIQ0aLC5w48gBQ,sentdex,2017-10-21T17:58:13Z,24
PLQVvvaa0QuDeF3hP0wQoSxpkqgRcgxMqX,OwakEEY_DFw,Pointers - Go Lang Practical Programming Tutorial p.4,2017-10-21T17:59:01Z,72620,994,78,PT4M18S,hd,"['pointers', 'Go', 'Go lang', 'go programming', 'tutorial', 'programming']",en,False,Go Language Programming Practical Basics Tutorial,UCfzlCWGWYyIQ0aLC5w48gBQ,sentdex,2017-10-21T17:58:13Z,24
PLQVvvaa0QuDeF3hP0wQoSxpkqgRcgxMqX,-QmdZ7821wA,Simple Web App - Go Lang Practical Programming Tutorial p.5,2017-10-21T17:59:06Z,135344,1761,106,PT8M17S,hd,"['web server', 'Go', 'Go lang', 'go programming', 'tutorial', 'programming']",en,False,Go Language Programming Practical Basics Tutorial,UCfzlCWGWYyIQ0aLC5w48gBQ,sentdex,2017-10-21T17:58:13Z,24
PLQVvvaa0QuDeF3hP0wQoSxpkqgRcgxMqX,3fsvqo9pQyg,Structs - Go Lang Practical Programming Tutorial p.6,2017-10-23T13:16:45Z,75055,942,33,PT7M10S,hd,"['structs', 'struct', 'Go', 'Go lang', 'go programming', 'tutorial', 'programming']",en,False,Go Language Programming Practical Basics Tutorial,UCfzlCWGWYyIQ0aLC5w48gBQ,sentdex,2017-10-21T17:58:13Z,24
PLQVvvaa0QuDeF3hP0wQoSxpkqgRcgxMqX,i3o4G4bmqPc,Methods - Value Receivers - Go Lang Practical Programming Tutorial p.7,2017-10-23T13:16:48Z,62298,816,42,PT6M14S,hd,"['method', 'value receiver', 'pointer receiver', 'Go', 'Go lang', 'go programming', 'tutorial', 'programming']",en,False,Go Language Programming Practical Basics Tutorial,UCfzlCWGWYyIQ0aLC5w48gBQ,sentdex,2017-10-21T17:58:13Z,24
PLQVvvaa0QuDeF3hP0wQoSxpkqgRcgxMqX,93f9_bJQdHk,Pointer Receivers - Go Lang Practical Programming Tutorial p.8,2017-10-23T13:16:53Z,56828,967,82,PT10M16S,hd,"['pointer receiver', 'method', 'value receiver', 'Go', 'Go lang', 'go programming', 'tutorial', 'programming']",en,False,Go Language Programming Practical Basics Tutorial,UCfzlCWGWYyIQ0aLC5w48gBQ,sentdex,2017-10-21T17:58:13Z,24
